,author,content,description,label,publishedAt,source_id,source_name,title,url,urlToImage
577,Reuters Editorial,"WASHINGTON (Reuters) - California professor Christine Blasey Ford has agreed to testify on Thursday morning before a U.S. Senate panel about her sexual assault allegations against Supreme Court nominee Brett Kavanaugh, her lawyers said on Sunday. “Despite act… [+409 chars]","California professor Christine Blasey Ford has agreed to testify on Thursday morning before a U.S. Senate panel about her sexual assault allegations against Supreme Court nominee Brett Kavanaugh, her lawyers said on Sunday.US",center,2018-09-23T17:03:13Z,reuters,Reuters,Kavanaugh accuser to testify Thursday in Senate: lawyers,https://www.reuters.com/article/us-usa-court-kavanaugh/kavanaugh-accuser-to-testify-thursday-in-senate-lawyers-idUSKCN1M30QN,https://s4.reutersmedia.net/resources/r/?m=02&d=20180923&t=2&i=1307409629&w=1200&r=LYNXNPEE8M0NS
578,Reuters Editorial,"WASHINGTON (Reuters) - A lawyer for a woman who has accused U.S. Supreme Court nominee Brett Kavanaugh of sexual assault on Wednesday criticized the Senate Judiciary Committee for scheduling a hearing on the matter for Monday, the Washington Post reported. “T… [+313 chars]","A lawyer for a woman who has accused U.S. Supreme Court nominee Brett Kavanaugh of sexual assault on Wednesday criticized the Senate Judiciary Committee for scheduling a hearing on the matter for Monday, the Washington Post reported.",center,2018-09-19T22:23:47Z,reuters,Reuters,Lawyer for Kavanaugh's accuser says Senate panel rushing to hearing,https://www.reuters.com/article/us-usa-court-kavanaugh-letter/lawyer-for-kavanaughs-accuser-says-senate-panel-rushing-to-hearing-idUSKCN1LZ2VY,https://s4.reutersmedia.net/resources_v2/images/rcom-default.png
579,Lawrence Hurley,WASHINGTON (Reuters) - A Republican U.S. Senate committee chairman said on Tuesday the woman who has accused President Donald Trump’s Supreme Court nominee Brett Kavanaugh of sexual assault decades ago has not yet agreed to appear at a public hearing planned … [+4959 chars],A Republican U.S. Senate committee chairman said on Tuesday the woman who has accused President Donald Trump's Supreme Court nominee Brett Kavanaugh of sexual assault decades ago has not yet agreed to appear at a public hearing planned for Monday.,center,2018-09-18T15:48:53Z,reuters,Reuters,Trump court nominee's accuser has not agreed to testify: senator,https://www.reuters.com/article/us-usa-court-kavanaugh/trump-court-nominees-accuser-has-not-agreed-to-testify-senator-idUSKCN1LY2E4,https://s3.reutersmedia.net/resources/r/?m=02&d=20180918&t=2&i=1305676499&w=1200&r=LYNXNPEE8H1MP
580,Reuters Editorial,WASHINGTON (Reuters) - White House adviser Kellyanne Conway said on Monday the woman who accused Supreme Court nominee Brett Kavanaugh of sexual misconduct will be heard as part of sworn testmiony before the committee weighing his nomination. “This woman shou… [+282 chars],White House adviser Kellyanne Conway said on Monday the woman who accused Supreme Court nominee Brett Kavanaugh of sexual misconduct will be heard as part of sworn testmiony before the committee weighing his nomination.,center,2018-09-17T12:04:27Z,reuters,Reuters,'This woman will be heard' - White House adviser on Kavanaugh accuser,https://www.reuters.com/article/us-usa-court-kavanaugh-conway/this-woman-will-be-heard-white-house-adviser-on-kavanaugh-accuser-idUSKCN1LX1AZ,https://s3.reutersmedia.net/resources/r/?m=02&d=20180917&t=2&i=1305251005&w=1200&r=LYNXNPEE8G0TK
581,Reuters Editorial,WASHINGTON (Reuters) - U.S. Senate Democratic leader Chuck Schumer on Monday called the sexual misconduct allegation brought by a woman against Supreme Court nominee Brett Kavanaugh extremely credible and said the FBI should reopen its background investigatio… [+501 chars],U.S. Senate Democratic leader Chuck Schumer on Monday called the sexual misconduct allegation brought by a woman against Supreme Court nominee Brett Kavanaugh extremely credible and said the FBI should reopen its background investigation on the judge.,center,2018-09-17T15:46:49Z,reuters,Reuters,Schumer: FBI should reopen Kavanaugh background check - ABC,https://www.reuters.com/article/us-usa-court-kavanaugh-schumer/schumer-fbi-should-reopen-kavanaugh-background-check-abc-idUSKCN1LX1VN,https://s1.reutersmedia.net/resources/r/?m=02&d=20180917&t=2&i=1305308956&w=1200&r=LYNXNPEE8G181
582,Lawrence Hurley,"WASHINGTON (Reuters) - President Donald Trump on Wednesday stepped up his defense of his U.S. Supreme Court pick, saying it is hard to imagine Brett Kavanaugh committed a sexual assault and that it would be unfortunate if the nominee’s accuser does not testif… [+5258 chars]","President Donald Trump on Wednesday stepped up his defense of his U.S. Supreme Court pick, saying it is hard to imagine Brett Kavanaugh committed a sexual assault and that it would be unfortunate if the nominee's accuser does not testify before the Senate.",center,2018-09-19T16:44:40Z,reuters,Reuters,"Trump defends his Supreme Court nominee, wants accuser to testify",https://www.reuters.com/article/us-usa-court-kavanaugh/trump-defends-his-supreme-court-nominee-wants-accuser-to-testify-idUSKCN1LZ1OX,https://s2.reutersmedia.net/resources/r/?m=02&d=20180919&t=2&i=1306041740&w=1200&r=LYNXNPEE8I1PC
583,Reuters Editorial,"WASHINGTON (Reuters) - A woman who has accused President Donald Trump’s U.S. Supreme Court nominee, Brett Kavanaugh, of sexual misconduct decades ago is willing to publicly testify before a Senate panel set to vote this week on his nomination, her lawyer said… [+1539 chars]","A woman who has accused President Donald Trump's U.S. Supreme Court nominee, Brett Kavanaugh, of sexual misconduct decades ago is willing to publicly testify before a Senate panel set to vote this week on his nomination, her lawyer said on Monday.",center,2018-09-17T12:18:03Z,reuters,Reuters,U.S. nominee Kavanaugh's accuser willing to testify: lawyer,https://www.reuters.com/article/us-usa-court-kavanaugh/u-s-nominee-kavanaughs-accuser-willing-to-testify-lawyer-idUSKCN1LW0OE,https://s4.reutersmedia.net/resources/r/?m=02&d=20180917&t=2&i=1305251011&w=1200&r=LYNXNPEE8G0TS
584,Doina Chiacu,WASHINGTON (Reuters) - U.S. Senate Republicans threatened to go ahead with a Senate panel vote on President Donald Trump’s Supreme Court nominee Brett Kavanaugh on Monday unless a deal could be reached on Friday with the woman accusing him of sexual assault o… [+5228 chars],U.S. Senate Republicans threatened to go ahead with a Senate panel vote on President Donald Trump's Supreme Court nominee Brett Kavanaugh on Monday unless a deal could be reached on Friday with the woman accusing him of sexual assault on how and when she will…,center,2018-09-22T01:01:38Z,reuters,Reuters,Republicans set Monday vote on Kavanaugh if no deal for hearing,https://www.reuters.com/article/us-usa-court-kavanaugh/republicans-set-monday-vote-on-kavanaugh-if-no-deal-for-hearing-idUSKCN1M11LX,https://s4.reutersmedia.net/resources/r/?m=02&d=20180921&t=2&i=1306766009&w=1200&r=LYNXNPEE8K14Z
585,Lawrence Hurley,"WASHINGTON (Reuters) - A woman who has accused Brett Kavanaugh, President Donald Trump’s U.S. Supreme Court nominee, of sexual misconduct decades ago is willing to publicly testify before a Senate panel set to vote this week on his nomination, her lawyer said… [+3642 chars]","A woman who has accused Brett Kavanaugh, President Donald Trump's U.S. Supreme Court nominee, of sexual misconduct decades ago is willing to publicly testify before a Senate panel set to vote this week on his nomination, her lawyer said on Monday.",center,2018-09-17T13:37:07Z,reuters,Reuters,"Trump high court pick Kavanaugh's accuser willing to testify, lawyer says",https://www.reuters.com/article/us-usa-court-kavanaugh/trump-high-court-pick-kavanaughs-accuser-willing-to-testify-lawyer-says-idUSKCN1LW0OE,https://s4.reutersmedia.net/resources/r/?m=02&d=20180917&t=2&i=1305251011&w=1200&r=LYNXNPEE8G0TS
586,Reuters Editorial,"WASHINGTON (Reuters) - A woman who has accused President Donald Trump’s U.S. Supreme Court nominee, Brett Kavanaugh, of sexual misconduct decades ago is willing to publicly testify before a Senate panel set to vote this week on his nomination, her lawyer said… [+2736 chars]","A woman who has accused President Donald Trump's U.S. Supreme Court nominee, Brett Kavanaugh, of sexual misconduct decades ago is willing to publicly testify before a Senate panel set to vote this week on his nomination, her lawyer said on Monday.",center,2018-09-17T12:59:53Z,reuters,Reuters,"U.S. high court nominee Kavanaugh's accuser willing to testify, lawyer says",https://www.reuters.com/article/us-usa-court-kavanaugh/u-s-high-court-nominee-kavanaughs-accuser-willing-to-testify-lawyer-says-idUSKCN1LW0OE,https://s4.reutersmedia.net/resources/r/?m=02&d=20180917&t=2&i=1305251011&w=1200&r=LYNXNPEE8G0TS
587,Lawrence Hurley,"WASHINGTON (Reuters) - The woman accusing Brett Kavanaugh, President Donald Trump’s U.S. Supreme Court nominee, of sexual assault faced a Friday deadline to decide whether to testify before a Senate panel as Republican lawmakers and the accuser remained locke… [+3346 chars]","The woman accusing Brett Kavanaugh, President Donald Trump's U.S. Supreme Court nominee, of sexual assault faced a Friday deadline to decide whether to testify before a Senate panel as Republican lawmakers and the accuser remained locked in a high-stakes stan…",center,2018-09-20T14:59:56Z,reuters,Reuters,Deadline looms for accuser of Trump's Supreme Court nominee,https://www.reuters.com/article/us-usa-court-kavanaugh/deadline-looms-for-accuser-of-trumps-supreme-court-nominee-idUSKCN1M02DM,https://s4.reutersmedia.net/resources/r/?m=02&d=20180920&t=2&i=1306406286&w=1200&r=LYNXNPEE8J1O8
588,Reuters Editorial,The following statements were posted to the verified personal Twitter account of U.S. President Donald Trump (@realDonaldTrump) The opinions expressed are his own. Reuters has not edited the statements or confirmed their accuracy. @realDonaldTrump : - NBC FAK… [+2811 chars],The following statements were posted to the verified personal Twitter account of U.S. President Donald Trump (@realDonaldTrump),center,2018-09-05T04:00:38Z,reuters,Reuters,"Trump on Twitter (Sept 4) - Kyl, Kavanaugh, Woodward, Mattis",https://www.reuters.com/article/us-usa-trump-tweet/trump-on-twitter-kyl-kavanaugh-woodward-mattis-idUSKCN1LL08Z,https://s3.reutersmedia.net/resources/r/?m=02&d=20180905&t=2&i=1300823338&w=1200&r=LYNXNPEE8405O
589,Reuters Editorial,"WASHINGTON (Reuters) - Another former classmate of Supreme Court appointee Brett Kavanaugh denies he attended a high school party where a California professor says the nominee sexually assaulted her three decades ago, CNN reported on Wednesday. Patrick J. Smy… [+2352 chars]","Another former classmate of Supreme Court appointee Brett Kavanaugh denies he attended a high school party where a California professor says the nominee sexually assaulted her three decades ago, CNN reported on Wednesday.",center,2018-09-19T12:53:13Z,reuters,Reuters,Former Kavanaugh classmate denies knowledge of sexual assault: CNN,https://www.reuters.com/article/us-usa-court-kavanaugh/former-kavanaugh-classmate-denies-knowledge-of-sexual-assault-cnn-idUSKCN1LZ1OX,https://s3.reutersmedia.net/resources/r/?m=02&d=20180919&t=2&i=1305993043&w=1200&r=LYNXNPEE8I1BM
590,Lawrence Hurley,WASHINGTON (Reuters) - Senate Judiciary Committee Republicans on Thursday thwarted a Democratic bid for more documents on President Donald Trump’s U.S. Supreme Court pick Brett Kavanaugh that could have delayed his confirmation and set a vote on the nominatio… [+1305 chars],Senate Judiciary Committee Republicans on Thursday thwarted a Democratic bid for more documents on President Donald Trump's U.S. Supreme Court pick Brett Kavanaugh that could have delayed his confirmation and set a vote on the nomination for next week.,center,2018-09-13T15:53:00Z,reuters,Reuters,Democrats fail in bid for U.S. Supreme Court nominee documents,https://www.reuters.com/article/us-usa-court-kavanaugh/democrats-fail-in-bid-for-u-s-supreme-court-nominee-documents-idUSKCN1LT2M7,https://s2.reutersmedia.net/resources/r/?m=02&d=20180913&t=2&i=1303986747&w=1200&r=LYNXNPEE8C1Q4
591,Doina Chiacu,"WASHINGTON (Reuters) - The university professor who has accused Brett Kavanaugh, President Donald Trump’s Supreme Court nominee, of sexual assault will testify before a Senate panel on Thursday about her allegation, her lawyers and the committee said on Sunda… [+4807 chars]","The university professor who has accused Brett Kavanaugh, President Donald Trump's Supreme Court nominee, of sexual assault will testify before a Senate panel on Thursday about her allegation, her lawyers and the committee said on Sunday.",center,2018-09-24T01:42:13Z,reuters,Reuters,Accuser of Kavanaugh to testify on Thursday,https://www.reuters.com/article/us-usa-court-kavanaugh/accuser-of-kavanaugh-to-testify-on-thursday-idUSKCN1M30QN,https://s4.reutersmedia.net/resources/r/?m=02&d=20180923&t=2&i=1307409629&w=1200&r=LYNXNPEE8M0NS
592,Lawrence Hurley,"WASHINGTON (Reuters) - A woman who has accused President Donald Trump’s Supreme Court nominee Brett Kavanaugh of sexual assault decades ago has not yet agreed to testify at a U.S. Senate hearing set for next Monday, raising questions about whether the high-st… [+5951 chars]","A woman who has accused President Donald Trump's Supreme Court nominee Brett Kavanaugh of sexual assault decades ago has not yet agreed to testify at a U.S. Senate hearing set for next Monday, raising questions about whether the high-stakes public showdown wi…",center,2018-09-18T20:18:04Z,reuters,Reuters,Doubts arise over whether Trump court nominee's accuser will testify,https://www.reuters.com/article/us-usa-court-kavanaugh/doubts-arise-over-whether-trump-court-nominees-accuser-will-testify-idUSKCN1LY2E4,https://s3.reutersmedia.net/resources/r/?m=02&d=20180918&t=2&i=1305676499&w=1200&r=LYNXNPEE8H1MP
593,Maria Caspani,"(Reuters) - A growing number of Americans said they opposed President Donald Trump’s Supreme Court nominee, Brett Kavanaugh, as the candidate’s confirmation hearings took place and as he fended off a sexual assault claim, a Reuters/Ipsos poll showed. The Sept… [+2229 chars]","A growing number of Americans said they opposed President Donald Trump’s Supreme Court nominee, Brett Kavanaugh, as the candidate's confirmation hearings took place and as he fended off a sexual assault claim, a Reuters/Ipsos poll showed.",center,2018-09-19T14:12:51Z,reuters,Reuters,"Opposition to Kavanaugh grows, support at historic low: Reuters/Ipsos poll",https://www.reuters.com/article/us-usa-court-kavanaugh-poll/opposition-to-kavanaugh-grows-support-at-historic-low-reuters-ipsos-poll-idUSKCN1LZ1WT,https://s3.reutersmedia.net/resources/r/?m=02&d=20180919&t=2&i=1306014891&w=1200&r=LYNXNPEE8I1GJ
594,Reuters Editorial,"WASHINGTON (Reuters) - U.S. President Donald Trump said on Friday that his Supreme Court nominee Brett Kavanaugh was “under assault” by radical leftist politicians, appearing to grow impatient with the delay of his appointee’s confirmation proceedings. “Judge… [+431 chars]","U.S. President Donald Trump said on Friday that his Supreme Court nominee Brett Kavanaugh was ""under assault"" by radical leftist politicians, appearing to grow impatient with the delay of his appointee's confirmation proceedings.US",center,2018-09-21T13:08:19Z,reuters,Reuters,Trump says Supreme Court nominee Kavanaugh is 'under assault',https://www.reuters.com/article/us-usa-court-kavanaugh-trump/trump-says-supreme-court-nominee-kavanaugh-is-under-assault-idUSKCN1M11MM,https://s4.reutersmedia.net/resources/r/?m=02&d=20180921&t=2&i=1306736015&w=1200&r=LYNXNPEE8K11S
595,Lawrence Hurley,"WASHINGTON (Reuters) - The woman accusing Brett Kavanaugh, President Donald Trump’s U.S. Supreme Court nominee, of sexual assault told a Senate committee she would be willing to testify later next week as a Friday deadline set by the Republican-led panel loom… [+2837 chars]","The woman accusing Brett Kavanaugh, President Donald Trump's U.S. Supreme Court nominee, of sexual assault told a Senate committee she would be willing to testify later next week as a Friday deadline set by the Republican-led panel loomed.US",center,2018-09-21T13:08:49Z,reuters,Reuters,Kavanaugh accuser seeks terms for testimony as deadline looms,https://www.reuters.com/article/us-usa-court-kavanaugh/kavanaugh-accuser-seeks-terms-for-testimony-as-deadline-looms-idUSKCN1M11LX,https://s4.reutersmedia.net/resources/r/?m=02&d=20180921&t=2&i=1306735158&w=1200&r=LYNXNPEE8K10Z
596,Reuters Editorial,"WASHINGTON (Reuters) - Republican U.S. Senator Susan Collins on Monday said both President Donald Trump’s Supreme Court nominee, Brett Kavanaugh, and the woman who has accused him of sexual misconduct should testify before the Senate Judiciary Committee under… [+325 chars]","Republican U.S. Senator Susan Collins on Monday said both President Donald Trump's Supreme Court nominee, Brett Kavanaugh, and the woman who has accused him of sexual misconduct should testify before the Senate Judiciary Committee under oath.",center,2018-09-17T16:14:55Z,reuters,Reuters,"Senator Collins: Trump court nominee, accuser should both testify",https://www.reuters.com/article/us-usa-court-kavanaugh-collins/senator-collins-trump-court-nominee-accuser-should-both-testify-idUSKCN1LX1X2,https://s2.reutersmedia.net/resources/r/?m=02&d=20180917&t=2&i=1305315645&w=1200&r=LYNXNPEE8G193
597,Roberta Rampton,"WASHINGTON (Reuters) - President Donald Trump on Wednesday said it would be “unfortunate” if the woman who has accused his Supreme Court nominee Brett Kavanaugh of sexual assault did not testify before a U.S. Senate committee, as he stepped up his defense of … [+3395 chars]","President Donald Trump on Wednesday said it would be ""unfortunate"" if the woman who has accused his Supreme Court nominee Brett Kavanaugh of sexual assault did not testify before a U.S. Senate committee, as he stepped up his defense of the conservative federa…",center,2018-09-19T14:08:33Z,reuters,Reuters,"Trump defends court nominee Kavanaugh, wants to hear from accuser",https://www.reuters.com/article/us-usa-court-kavanaugh/trump-defends-court-nominee-kavanaugh-wants-to-hear-from-accuser-idUSKCN1LZ1OX,https://s3.reutersmedia.net/resources/r/?m=02&d=20180919&t=2&i=1305996289&w=1200&r=LYNXNPEE8I1BM
598,Reuters Editorial,"WASHINGTON (Reuters) - The Senate Judiciary Committee will reopen its hearings on the nomination of Brett Kavanaugh to a seat on the U.S. Supreme Court following allegations of sexual misconduct that he has denied, Republican Senator John Thune said on Monday… [+455 chars]","The Senate Judiciary Committee will reopen its hearings on the nomination of Brett Kavanaugh to a seat on the U.S. Supreme Court following allegations of sexual misconduct that he has denied, Republican Senator John Thune said on Monday.",center,2018-09-17T22:24:14Z,reuters,Reuters,Senate Judiciary to probe Kavanaugh accusation in public hearing,https://www.reuters.com/article/us-usa-court-kavanaugh-hearing/senate-judiciary-to-probe-kavanaugh-accusation-in-public-hearing-idUSKCN1LX2KL,https://s3.reutersmedia.net/resources/r/?m=02&d=20180917&t=2&i=1305404768&w=1200&r=LYNXNPEE8G1NP
599,Richard Cowan,"WASHINGTON (Reuters) - U.S. Supreme Court nominee Brett Kavanaugh said on Monday he would not step aside after a second woman accused him of sexual misconduct decades ago, with President Donald Trump and fellow Republicans showing no sign of relenting in thei… [+4837 chars]","U.S. Supreme Court nominee Brett Kavanaugh said on Monday he would not step aside after a second woman accused him of sexual misconduct decades ago, with President Donald Trump and fellow Republicans showing no sign of relenting in their push for his Senate c…",center,2018-09-24T18:51:15Z,reuters,Reuters,Trump court nominee says he won't be 'intimidated' into withdrawing,https://www.reuters.com/article/us-usa-court-kavanaugh-trump/trump-court-nominee-says-he-wont-be-intimidated-into-withdrawing-idUSKCN1M41JU,https://s4.reutersmedia.net/resources/r/?m=02&d=20180924&t=2&i=1307767621&w=1200&r=LYNXNPEE8N11W
600,Reuters Editorial,"WASHINGTON (Reuters) - President Donald Trump said on Wednesday it was up to the U.S. Senate how to handle a sexual assault allegation brought by a woman against his Supreme Court nominee Brett Kavanaugh. Speaking to reporters at the White House, Trump said i… [+237 chars]",President Donald Trump said on Wednesday it was up to the U.S. Senate how to handle a sexual assault allegation brought by a woman against his Supreme Court nominee Brett Kavanaugh.,center,2018-09-19T13:36:49Z,reuters,Reuters,Trump says it is up to Senate how to handle accusation against court nominee,https://www.reuters.com/article/us-usa-court-kavanaugh-trump/trump-says-it-is-up-to-senate-how-to-handle-accusation-against-court-nominee-idUSKCN1LZ1SX,https://s3.reutersmedia.net/resources/r/?m=02&d=20180919&t=2&i=1306005263&w=1200&r=LYNXNPEE8I1EL
601,Reuters Editorial,"(Reuters) - U.S. Senate Judiciary Committee Chairman Chuck Grassley set a 2:30 p.m. EST Saturday deadline for a woman accusing Supreme Court nominee Brett Kavanaugh of sexual assault to negotiate terms of her testimony, the New York Times reported. The Commit… [+335 chars]","U.S. Senate Judiciary Committee Chairman Chuck Grassley set a 2:30 p.m. EST Saturday deadline for a woman accusing Supreme Court nominee Brett Kavanaugh of sexual assault to negotiate terms of her testimony, the New York Times reported.US",center,2018-09-22T06:43:48Z,reuters,Reuters,U.S. Senate's Grassley sets Kavanaugh's accuser Saturday deadline for testimony terms: NY Times,https://www.reuters.com/article/us-usa-court-kavanaugh-saturday/u-s-senates-grassley-sets-kavanaughs-accuser-saturday-deadline-for-testimony-terms-ny-times-idUSKCN1M2084,https://s3.reutersmedia.net/resources/r/?m=02&d=20180922&t=2&i=1306972812&w=1200&r=LYNXNPEE8L05M
602,Reuters Editorial,"WASHINGTON (Reuters) - The woman accusing U.S. Supreme Court nominee Brett Kavanaugh of sexual assault decades ago says she wants the FBI to probe the allegations before she testifies before the Senate Judiciary Committee, CNN reported on Tuesday. It said tha… [+435 chars]","The woman accusing U.S. Supreme Court nominee Brett Kavanaugh of sexual assault decades ago says she wants the FBI to probe the allegations before she testifies before the Senate Judiciary Committee, CNN reported on Tuesday.",center,2018-09-19T00:24:06Z,reuters,Reuters,Kavanaugh's accuser wants FBI to probe allegations before testifying: CNN,https://www.reuters.com/article/us-usa-court-kavanaugh-probe/kavanaughs-accuser-wants-fbi-to-probe-allegations-before-testifying-cnn-idUSKCN1LZ014,https://s4.reutersmedia.net/resources_v2/images/rcom-default.png
603,Lawrence Hurley,"WASHINGTON (Reuters) - A lawyer for the woman accusing Brett Kavanaugh, President Donald Trump’s U.S. Supreme Court nominee, of sexual assault told a Senate panel the professor would be willing to testify next week if it provides “terms that are fair and whic… [+4518 chars]","A lawyer for the woman accusing Brett Kavanaugh, President Donald Trump's U.S. Supreme Court nominee, of sexual assault told a Senate panel the professor would be willing to testify next week if it provides ""terms that are fair and which ensure her safety,"" a…",center,2018-09-20T20:01:06Z,reuters,Reuters,Accuser of Trump's high court nominee willing to testify: email,https://www.reuters.com/article/us-usa-court-kavanaugh/accuser-of-trumps-high-court-nominee-willing-to-testify-email-idUSKCN1M02DM,https://s4.reutersmedia.net/resources/r/?m=02&d=20180920&t=2&i=1306406286&w=1200&r=LYNXNPEE8J1O8
604,Lawrence Hurley,"WASHINGTON (Reuters) - U.S. Supreme Court nominee Brett Kavanaugh and the woman who accused him of a 1982 sexual assault will be called to testify in the Senate next Monday, the chamber’s Judiciary Committee chairman said, pushing back a key vote in the judge… [+1711 chars]","U.S. Supreme Court nominee Brett Kavanaugh and the woman who accused him of a 1982 sexual assault will be called to testify in the Senate next Monday, the chamber's Judiciary Committee chairman said, pushing back a key vote in the judge's confirmation process.",center,2018-09-17T22:52:28Z,reuters,Reuters,"Senate Judiciary to probe Kavanaugh, accuser in public hearing",https://www.reuters.com/article/us-usa-court-kavanaugh/senate-judiciary-to-probe-kavanaugh-accuser-in-public-hearing-idUSKCN1LW0OE,https://s4.reutersmedia.net/resources/r/?m=02&d=20180917&t=2&i=1305251011&w=1200&r=LYNXNPEE8G0TS
605,Doina Chiacu,"WASHINGTON (Reuters) - U.S. President Donald Trump on Friday sought to cast doubt on the woman who has accused his Supreme Court nominee Brett Kavanaugh of sexual assault, saying if the attack was “as bad as she says,” it would have been immediately reported … [+5541 chars]","U.S. President Donald Trump on Friday sought to cast doubt on the woman who has accused his Supreme Court nominee Brett Kavanaugh of sexual assault, saying if the attack was ""as bad as she says,"" it would have been immediately reported to police.",center,2018-09-21T23:41:33Z,reuters,Reuters,"Trump questions Kavanaugh's accuser, says opponents want to 'destroy' Supreme Court nominee",https://www.reuters.com/article/us-usa-court-kavanaugh/trump-questions-kavanaughs-accuser-says-opponents-want-to-destroy-supreme-court-nominee-idUSKCN1M11LX,https://s4.reutersmedia.net/resources/r/?m=02&d=20180921&t=2&i=1306766009&w=1200&r=LYNXNPEE8K14Z
