,author,content,description,label,publishedAt,source_id,source_name,title,url,urlToImage
288,JOUMANA KHATIB and MERRILL D. OLIVER,"10. And finally, something to think about when you make your coffee in the morning: Melitta Bentz was tired of finding coffee grounds in her cup. So in 1908, she patented a solution that many of us now rely on daily: the coffee filter. It was easy to clean, h… [+509 chars]",Here’s what you need to know at the end of the day.,center,2018-09-06T22:24:27Z,the-new-york-times,The New York Times,"Burt Reynolds, Brett Kavanaugh, Alex Jones: Your Thursday Evening Briefing",https://www.nytimes.com/2018/09/06/briefing/burt-reynolds-brett-kavanaugh-alex-jones.html,https://static01.nyt.com/images/2018/09/06/world/0907-pm-promo/0907-pm-promo-facebookJumbo.jpg
289,JOUMANA KHATIB and MARCUS PAYADUE,"1. “The root of the problem is the president’s amorality.” From Opinion: In an anonymous Op-Ed essay, a senior Trump administration official says he and other like-minded colleagues believe the “president continues to act in a manner that is detrimental to th… [+734 chars]",Here’s what you need to know at the end of the day.,center,2018-09-05T22:17:11Z,the-new-york-times,The New York Times,"Trump, Ayanna Pressley, Brett Kavanaugh: Your Wednesday Evening Briefing",https://www.nytimes.com/2018/09/05/briefing/trump-ayanna-pressley-brett-kavanaugh.html,https://static01.nyt.com/images/2018/09/05/briefing/05evening-Briefing-US-core-2-alpha/05evening-Briefing-US-slide-34W7-facebookJumbo.jpg
290,,"To the Editor: As fellow members of the Yale College Class of 1987 and other alumni of Yale University, we call upon Brett Kavanaugh (Yale ’87) to keep faith with our alma mater’s highest ideals of “lux et veritas” — “light and truth” — by requesting that all… [+609 chars]",Senators on the Judiciary Committee pressed Judge Brett Kavanaugh on Thursday about the constitutional right to abortion and his views on the special counsel.,center,2018-09-09T19:00:00Z,the-new-york-times,The New York Times,"letter: Brett Kavanaugh, Release All Your Records",https://www.nytimes.com/2018/09/09/opinion/letters/brett-kavanaugh-documents.html,https://static01.nyt.com/images/2018/09/07/us/politics/07us-ambriefing-kavanaugh/07us-ambriefing-kavanough-facebookJumbo.jpg
291,ERIC J. SEGALL,"Consider that Justice Thomas, along with Justice Scalia, voted to strike down huge swaths of constitutional law without historical justification. Together they invalidated state and federal affirmative action laws, campaign finance legislation, federal laws d… [+3029 chars]","Brett Kavanaugh testifiying at his confirmation hearing before the Senate Judiciary Committee, on Capitol Hill in Washington, D.C.",center,2018-09-10T10:00:03Z,the-new-york-times,The New York Times,Does Originalism Matter Anymore?,https://www.nytimes.com/2018/09/10/opinion/kavanaugh-originalism-supreme-court.html,https://static01.nyt.com/images/2018/09/10/opinion/10SEGALL/10SEGALL-facebookJumbo.jpg
292,,"To the Editor: Re “ Emails Give Rise to New Battling Over Kavanaugh ” (front page, Sept. 7): The three days of Senate Judiciary Committee hearings regarding the nomination of Brett M. Kavanaugh to the Supreme Court have made it abundantly clear that the deck … [+1257 chars]",Senators on the Judiciary Committee pressed Judge Brett Kavanaugh on Thursday about the constitutional right to abortion and his views on the special counsel.,center,2018-09-07T21:26:05Z,the-new-york-times,The New York Times,letters: What We Learned From the Kavanaugh Hearings,https://www.nytimes.com/2018/09/07/opinion/letters/kavanaugh-supreme-court.html,https://static01.nyt.com/images/2018/09/07/us/politics/07us-ambriefing-kavanaugh/07us-ambriefing-kavanough-facebookJumbo.jpg
293,http://www.nytimes.com/by/adam-liptak,"That did not stop him from joining a decision in June that overruled a 40-year-old precedent in a decision that dealt a sharp blow to public labor unions. In general, though, a court with the chief justice at its center would most likely move steadily to the … [+1711 chars]","New York Times How Brett Kavanaugh Would Transform the Supreme Court New York Times WASHINGTON — Most Supreme Court appointments are in a way inconsequential. A conservative replaces a conservative, a liberal replaces a liberal, and the court's basic directio…",center,2018-09-02T20:13:04Z,the-new-york-times,The New York Times,How Brett Kavanaugh Would Transform the Supreme Court - New York Times,https://www.nytimes.com/2018/09/02/us/politics/judge-kavanaugh-supreme-court-justices.html,https://static01.nyt.com/images/2018/09/01/us/politics/00dc-kavanaugh1/00dc-kavanaugh1-facebookJumbo.jpg
294,MICHELLE GOLDBERG,"As I write this, we don’t know what Harris’s information is. The exchange hinted at a potentially scandalous conflict of interest, though Kasowitz’s firm has denied that any such conversation took place, and when Kavanaugh was questioned again by Harris on Th… [+2576 chars]","Judge Brett Kavanaugh, seen at his Supreme Court confirmation hearing, has wide support from Republicans — even those who privately think President Trump is unfit.",center,2018-09-07T09:45:03Z,the-new-york-times,The New York Times,The Corrupt Bargain of the Adults in the Room,https://www.nytimes.com/2018/09/07/opinion/columnists/kavanaugh-trump-kamala-harris-anonymous.html,https://static01.nyt.com/images/2018/09/07/opinion/07goldbergWeb/07goldbergWeb-facebookJumbo.jpg
295,SEAN WILENTZ,"But shortly after the Senate report was released, Mr. Kavanaugh convinced Mr. Starr to reopen what he called a “full-fledged” investigation of the Foster matter, telling his colleagues, as justification, that “we have received allegations that Mr. Foster’s de… [+2220 chars]","Brett Kavanaugh, who served as associate counsel in the Office of Independent Counsel under Kenneth Starr, sat behind Mr. Starr at a House Judiciary Committee hearing on President Bill Clinton on 1998.",center,2018-09-05T19:00:03Z,the-new-york-times,The New York Times,Why Was Kavanaugh Obsessed With Vince Foster?,https://www.nytimes.com/2018/09/05/opinion/why-was-kavanaugh-obsessed-with-vince-foster.html,https://static01.nyt.com/images/2018/09/05/opinion/05Wilentz/05Wilentz-facebookJumbo.jpg
296,DAVID A. KAPLAN,"Of course, the court sometimes must act decisively to protect rights. By design, the unelected, largely unaccountable Supreme Court serves as a bulwark against tyrannical majorities. The First Amendment’s guarantee of free expression envisions the protection … [+2588 chars]",The nomination of Brett Kavanaugh might not be so contentious if the justices stopped jumping into disputes better left to the political process.,center,2018-09-03T10:00:03Z,the-new-york-times,The New York Times,The Supreme Court Ought to Back Off,https://www.nytimes.com/2018/09/03/opinion/supreme-court-kavanaugh-partisan.html,https://static01.nyt.com/images/2018/08/31/opinion/31kaplan/31kaplan-facebookJumbo.jpg
297,CHARLES M. BLOW,"Affirmative action is a thorny issue, an imperfect tool to push society toward more perfect equality. It creates a current preference to counterbalance a historical preference. In this equation, there will always be winners and losers. Many people who have be… [+2276 chars]",Brett Kavanaugh knows firsthand that affirmative action works and he uses it to hire female law clerks. But he opposes it as policy.,center,2018-09-06T01:33:11Z,the-new-york-times,The New York Times,Affirmative Action Spectacle,https://www.nytimes.com/2018/09/05/opinion/kavanaugh-confirmation-female-clerks.html,https://static01.nyt.com/images/2018/09/05/opinion/05blowWeb/05blowWeb-facebookJumbo.jpg
298,,"To the Editor: Re “ Democrats Hurl Fierce Barrage at Court Choice ” (front page, Sept. 5): Senators Mitch McConnell and Chuck Grassley have good reason to rush the hearings for Judge Brett Kavanaugh, President Trump’s nominee for the Supreme Court, fearing th… [+1234 chars]",Judge Brett Kavanaugh held a copy of the Constitution during the second day of his Supreme Court confirmation hearing in front of the Senate Judiciary Committee.,center,2018-09-05T18:18:16Z,the-new-york-times,The New York Times,letters: Partisan Politics and Court Nominees,https://www.nytimes.com/2018/09/05/opinion/letters/kavanaugh-supreme-court.html,https://static01.nyt.com/images/2018/09/06/us/politics/06dc-kavanaugh1/06dc-kavanaugh1-facebookJumbo.jpg
299,FRANK BRUNI and ROSS DOUTHAT,"Ross Douthat: Frank, it’s good to be back with you. The last time we conversed, we agreed that the Kavanaugh hearings would be a snooze, all grandstanding and no revelations, leading up to the all-but-foregone conclusion of his confirmation. We were mostly ri… [+1654 chars]",Judge Brett Kavanaugh at his confirmation hearing on Sept. 5. He is expected to appear before the Senate Judiciary Committee again next Monday to answer sexual-assault accusations.,center,2018-09-18T09:45:08Z,the-new-york-times,The New York Times,The Conversation: Should Brett Kavanaugh Withdraw?,https://www.nytimes.com/2018/09/18/opinion/kavanaugh-christine-blasey-ford-supreme-court.html,https://static01.nyt.com/images/2018/09/18/opinion/18conversationWeb/18conversationWeb-facebookJumbo.jpg
300,JACEY FORTIN,"But even when people do go public with their memories, it can be as traumatic as it is liberating. Ms. Chondoma used the #WhyIDidntReport hashtag in a tweet on Friday. When she saw how many responses her post got, she felt exposed and overwhelmed even though … [+1221 chars]","Activists protesting the nomination of Judge Brett M. Kavanaugh to the Supreme Court. When President Trump asked why a woman who accused the judge of sexual assault did not come forward sooner, women responded with their stories and #WhyIDidntReport.",center,2018-09-23T16:41:48Z,the-new-york-times,The New York Times,#WhyIDidntReport: Survivors of Sexual Assault Share Their Stories After Trump Tweet,https://www.nytimes.com/2018/09/23/us/why-i-didnt-report-assault-stories.html,https://static01.nyt.com/images/2018/09/23/us/00xp-whyididntreport/00xp-whyididntreport-facebookJumbo.jpg
301,CHARLES M. BLOW,"Then came the allegation of sexual harassment brought by Professor Hill, and everything changed. It is not that Hill wasnt credible, but it was that Thomas was on the defensive and the image of yet another black man under attack from a group of white men had … [+2117 chars]",There’s one distinct difference between the Clarence Thomas hearings and the Brett Kavanaugh hearings.,center,2018-09-24T00:08:45Z,the-new-york-times,The New York Times,"Thomas, Kavanaugh and Race",https://www.nytimes.com/2018/09/23/opinion/clarence-thomas-brett-kavanugh-anita-hill.html,https://static01.nyt.com/images/2018/09/23/opinion/23blow/23blow-facebookJumbo.jpg
302,ROSS DOUTHAT,"These arguments would be convincing, I think, if Kavanaugh were up for a lower court appointment, or running for a Senate seat. But the sheer abnormality of the Supreme Court — lifetime tenure, philosopher-king power — makes the prospect of a reputationally-c… [+2241 chars]",Supreme Court justice nominee judge Brett Kavanaugh during his Senate confirmation hearing.,center,2018-09-22T18:30:07Z,the-new-york-times,The New York Times,The Burden of Proof for Kavanaugh,https://www.nytimes.com/2018/09/22/opinion/sunday/brett-kavanaugh-burden-of-proof.html,https://static01.nyt.com/images/2018/09/23/opinion/sunday/23Douthat/23Douthat-facebookJumbo.jpg
303,,"To the Editor: Re “ Court Nominee Called Roe v. Wade ‘Settled Law’ ” (news article, Aug. 22): It appears that Senator Susan Collins is prepared to vote to confirm Brett M. Kavanaugh as a justice of the Supreme Court because he has told her that he considers t… [+807 chars]",Readers are not comforted by the Supreme Court nominee’s statement that Roe v. Wade is “settled law.”,center,2018-08-26T19:00:00Z,the-new-york-times,The New York Times,letters: Advice to Senator Collins: Be Skeptical of Kavanaugh,https://www.nytimes.com/2018/08/26/opinion/letters/susan-collins-brett-kavanaugh-roe.html,https://static01.nyt.com/images/2018/07/10/opinion/10brettschneider-Sub/10brettschneider-Sub-facebookJumbo.jpg
304,MATTHEW GOLDSTEIN,"Michael Roth, a lawyer with Boies Schiller Flexner, which represents RD Legal, said in a statement that the case never should have been brought. “Today’s order provides for the full relief we originally requested in our motion to dismiss,” he said. The consum… [+1164 chars]","The ruling permits New York officials to file a new lawsuit in state court against RD Legal Funding, which they say deceived emergency workers and former N.F.L. players awaiting settlements.",center,2018-09-12T23:12:24Z,the-new-york-times,The New York Times,Judge Dismisses Federal Suit Accusing Firm of Defrauding 9/11 Responders,https://www.nytimes.com/2018/09/12/business/september-11-attacks-nfl-concussion-settlements.html,https://static01.nyt.com/images/2018/09/13/business/13RDLEGAL/13RDLEGAL-facebookJumbo.jpg
305,,Chat with us in Facebook Messenger. Find out what's happening in the world as it unfolds.,Supreme Court nominee Brett Kavanaugh struggles to answer Sen. Kamala Harris' question on whether he discussed the Mueller investigation with anyone at Kasowitz Benson Torres.,left,2018-09-06T04:46:27Z,cnn,CNN,Senator challenges Kavanaugh on Mueller probe,https://www.cnn.com/videos/politics/2018/09/06/brett-kavanaugh-kamala-harris-mueller-investigation-sot-vpx.cnn,https://cdn.cnn.com/cnnnext/dam/assets/180906004156-kamala-harris-brett-kavanaugh-super-tease.jpg
306,,Chat with us in Facebook Messenger. Find out what's happening in the world as it unfolds.,"Sen. Richard Blumenthal (D-NY) grills Supreme Court nominee Brett Kavanaugh about President Trump's tweets saying Supreme Court Justice Ruth Bader Ginsburg's ""mind is shot.""",left,2018-09-06T21:19:48Z,cnn,CNN,Kavanaugh won't condemn Trump's Ginsburg tweets,https://www.cnn.com/videos/politics/2018/09/06/blumenthal-kavanaugh-trump-tweets-ginsburg-bts-vpx.cnn,https://cdn.cnn.com/cnnnext/dam/assets/180906171435-kavanaugh-09062018-super-tease.jpg
307,,Chat with us in Facebook Messenger. Find out what's happening in the world as it unfolds.,Sen. Cory Booker (D-NJ) questions Supreme Court nominee Brett Kavanaugh about his loyalty to President Trump and how that could affect his decisions on the bench.,left,2018-09-07T00:31:14Z,cnn,CNN,Kavanaugh dodges question about Trump loyalty,https://www.cnn.com/videos/politics/2018/09/06/cory-booker-kavanaugh-trump-loyalty-bts-wolf-vpx.cnn,https://cdn.cnn.com/cnnnext/dam/assets/180906191528-booker-kavanaugh-2-super-tease.jpg
308,,Chat with us in Facebook Messenger. Find out what's happening in the world as it unfolds.,Supreme Court nominee Brett Kavanaugh delivers his opening statement to the Senate Judiciary Committee on the first day of his confirmation hearings.,left,2018-09-04T22:04:00Z,cnn,CNN,Hear Kavanaugh's opening statement,https://www.cnn.com/videos/politics/2018/09/04/brett-kavanaugh-opening-statement-confirmation-sot-lead-vpx.cnn,https://cdn.cnn.com/cnnnext/dam/assets/180904170550-13-kavanaugh-hearings-0904-unfurled-super-tease.jpg
309,"Joan Biskupic, CNN","(CNN) After a raucous Senate hearing during which he remained steady and now appears headed for confirmation, Judge Brett Kavanaugh will soon be positioned for immediate impact on the Supreme Court. The 53-year-old judge who grew up inside the Washington Belt… [+4914 chars]","After a raucous Senate hearing during which he remained steady and now appears headed for confirmation, Judge Brett Kavanaugh will soon be positioned for immediate impact on the Supreme Court.",left,2018-09-08T11:57:06Z,cnn,CNN,What we learned about Judge Kavanaugh,https://www.cnn.com/2018/09/08/politics/kavanaugh-future-supreme-court/index.html,https://cdn.cnn.com/cnnnext/dam/assets/180904172348-13-kavanaugh-hearings-0904-unfurled-super-tease.jpg
310,,Chat with us in Facebook Messenger. Find out what's happening in the world as it unfolds.,"Fred Guttenberg, the father of a slain Parkland student, said he tried to approach Supreme Court nominee Brett Kavanaugh only for the judge to ignore him. White House deputy press secretary Raj Shah addressed the moment on Twitter, saying, ""Before the Judge w…",left,2018-09-05T00:40:00Z,cnn,CNN,Parkland dad describes Kavanaugh interaction,https://www.cnn.com/videos/politics/2018/09/04/brett-kavanaugh-parkland-father-fred-guttenberg-handshake-erin-intv-bolduan-vpx.cnn,https://cdn.cnn.com/cnnnext/dam/assets/180904202312-fred-guttenberg-parkland-dad-intv-kavanaugh-super-tease.jpg
311,"Kelly Murray, CNN",,A group of protesters bearing a message as stark as their red and white costumes are opposing Brett Kavanaugh's Supreme Court confirmation hearings.,left,2018-09-05T08:02:25Z,cnn,CNN,A silent protest with a very loud message: Stop Kavanaugh,https://www.cnn.com/2018/09/05/politics/kavanaugh-senate-hearing-handmaids-tale-protesters/index.html,https://cdn.cnn.com/cnnnext/dam/assets/180904233053-handmaids-tale-protesters-kavanaugh-02-super-tease.jpg
312,,Chat with us in Facebook Messenger. Find out what's happening in the world as it unfolds.,"CNN's Chris Cuomo criticizes Supreme Court nominee Brett Kavanaugh for failing to interact with the father of a slain Parkland student, Fred Guttenberg, and White House deputy press secretary Raj Shah's defense of his actions.",left,2018-09-05T03:13:41Z,cnn,CNN,Cuomo slams spin of denied handshake,https://www.cnn.com/videos/politics/2018/09/05/brett-kavanaugh-handshake-parkland-father-cuomo-closing-cpy-vpx.cnn,https://cdn.cnn.com/cnnnext/dam/assets/180904224049-chris-cuomo-closing-0904-super-tease.jpg
313,,Chat with us in Facebook Messenger. Find out what's happening in the world as it unfolds.,"A reporter asked Sen. Cory Booker (D-NJ) if he was ready to be expelled from the Senate following Booker's decision to release an email linking to documents about Supreme Court nominee Brett Kavanaugh marked ""committee confidential.""",left,2018-09-06T16:56:39Z,cnn,CNN,Booker asked if he's prepared to be expelled,https://www.cnn.com/videos/politics/2018/09/06/cory-booker-ready-to-be-expelled-senate-sot-vpx.cnn,https://cdn.cnn.com/cnnnext/dam/assets/180906125254-cory-booker-september-6-2018-01-super-tease.jpg
314,"Joan Biskupic, CNN legal analyst & Supreme Court biographer",,"Supreme Court nominee Brett Kavanaugh on Wednesday described Roe v. Wade's right to abortion as settled -- ""important precedent"" -- yet he has also narrowly interpreted when a woman can exercise that right.",left,2018-09-06T01:39:33Z,cnn,CNN,"Roe v Wade is 'precedent,' Kavanaugh says, but there's more to the future of abortion",https://www.cnn.com/2018/09/05/politics/kavanaugh-roe-v-wade-planned-parenthood-casey/index.html,https://cdn.cnn.com/cnnnext/dam/assets/180905145234-kavanaugh-0905---5-super-tease.jpg
315,"Veronica Stracqualursi, CNN",,US Capitol Police said they had arrested 73 people in the Senate office buildings by the end of the second day of Supreme Court nominee Brett Kavanaugh's confirmation hearings.,left,2018-09-06T11:52:47Z,cnn,CNN,Capitol Police arrest 73 on day two of Kavanaugh hearings,https://www.cnn.com/2018/09/06/politics/kavanaugh-hearing-day-two-capitol-hill-police-arrests/index.html,https://cdn.cnn.com/cnnnext/dam/assets/180904095723-06-kavanaugh-hearing-0904-super-tease.jpg
316,"Stephen Collinson, CNN",(CNN) The second day of questioning in Supreme Court nominee Brett Kavanaugh's confirmation hearing began with another bitter controversy over the GOP's handling of the process and the behavior of Democrats seeking to slow his confirmation. New Jersey Democra… [+2844 chars],The second day of questioning in Supreme Court nominee Brett Kavanaugh's confirmation hearing began with another bitter controversy over the GOP's handling of the process and the behavior of Democrats seeking to slow his confirmation.,left,2018-09-06T14:33:00Z,cnn,CNN,Booker says he's willing to break rules and release Kavanaugh documents,https://www.cnn.com/2018/09/06/politics/kavanaugh-hearing-document-booker-testimony/index.html,https://cdn.cnn.com/cnnnext/dam/assets/180905145234-kavanaugh-0905---5-super-tease.jpg
317,,Chat with us in Facebook Messenger. Find out what's happening in the world as it unfolds.,"President Trump said that he feels bad for his Supreme Court nominee Brett Kavanaugh, who was accused of sexual assault earlier this week. Kavanaugh denies the accusation.",left,2018-09-18T19:28:45Z,cnn,CNN,Trump: I feel bad for Kavanaugh,https://www.cnn.com/videos/politics/2018/09/18/trump-kavanaugh-accusation-i-feel-bad-for-him-sot-vpx-nr.cnn,https://cdn.cnn.com/cnnnext/dam/assets/180918143959-president-trump-917-super-tease.jpg
318,,Chat with us in Facebook Messenger. Find out what's happening in the world as it unfolds.,Rep. Ralph Norman (R-SC) made a crude joke about the sexual assault allegation made against Supreme Court nominee Brett Kavanaugh. Kavanaugh has denied the allegation.,left,2018-09-21T00:14:17Z,cnn,CNN,See GOP lawmaker's crude joke mocking accuser,https://www.cnn.com/videos/politics/2018/09/20/ralph-norman-joke-kavanaugh-accuser-ebof-vpx.cnn,https://cdn.cnn.com/cnnnext/dam/assets/180920193954-ralph-norman-joke-kavanaugh-accuser-ebof-vpx-00000000-super-tease.jpg
319,,Chat with us in Facebook Messenger. Find out what's happening in the world as it unfolds.,President Trump comments on the allegations of sexual assault against his Supreme Court nominee Brett Kavanaugh.,left,2018-09-17T19:53:25Z,cnn,CNN,Trump speaks about Kavanaugh after allegations,https://www.cnn.com/videos/politics/2018/09/17/trump-remarks-kavanaugh-allegations-sot-nr-vpx.cnn,https://cdn.cnn.com/cnnnext/dam/assets/180917152041-trump-kavanaugh-remarks-super-tease.jpg
320,,Chat with us in Facebook Messenger. Find out what's happening in the world as it unfolds.,A CNN panel discussion gets heated over the Brett Kavanaugh sexual assault allegations.,left,2018-09-20T21:26:01Z,cnn,CNN,Panelist: Don't talk to me like that,https://www.cnn.com/videos/politics/2018/09/20/kavanaugh-ford-symone-sanders-amanda-carpenter-panel-lead-panel-sots-vpx.cnn,https://cdn.cnn.com/cnnnext/dam/assets/180920172200-sanders-carpenter-lead-panel-super-tease.jpg
321,,Chat with us in Facebook Messenger. Find out what's happening in the world as it unfolds.,Director Michael Moore speaks to CNN's Chris Cuomo about allegations of sexual assault against Supreme Court nominee Brett Kavanaugh.,left,2018-09-19T01:43:26Z,cnn,CNN,Michael Moore: Kavanaugh nomination should be withdrawn,https://www.cnn.com/videos/politics/2018/09/19/michael-moore-kavanaugh-accusations-cuomo-vpx.cnn,https://cdn.cnn.com/cnnnext/dam/assets/180918213058-director-michael-moore-super-tease.jpg
322,,Chat with us in Facebook Messenger. Find out what's happening in the world as it unfolds.,CNN's Brian Stelter thinks President Donald Trump will side with Supreme Court nominee Brett Kavanaugh after a woman came forward to accuse Kavanaugh of committing sexual assault in the 1980s.,left,2018-09-16T19:45:55Z,cnn,CNN,Stelter: Trump will likely take Kavanaugh's side,https://www.cnn.com/videos/politics/2018/09/16/brian-stelter-trump-will-likely-side-with-brett-kavanaugh-nr-vpx.cnn,https://cdn.cnn.com/cnnnext/dam/assets/180916153939-brian-stelter-09162018-super-tease.jpg
323,,Chat with us in Facebook Messenger. Find out what's happening in the world as it unfolds.,"Ed Whelan, a conservative strategist and defender of Supreme Court nominee Brett Kavanaugh, apologized for making ""an appalling and inexcusable mistake"" when he claimed that Kavanaugh's accuser had misidentified her alleged assailant as Kavanaugh.",left,2018-09-22T01:54:09Z,cnn,CNN,Whelan apologizes for conspiracy theory,https://www.cnn.com/videos/politics/2018/09/22/ed-whelan-twitter-brett-kavanaugh-allegations-kth-ac-sot-vpx.cnn,https://cdn.cnn.com/cnnnext/dam/assets/180921210016-ed-whelan-super-tease.jpg
324,"Kaitlan Collins, CNN","Washington (CNN) Both Brett Kavanaugh and Christine Blasey Ford, the professor who has accused of him of sexual assault as a teenager, have received a slew of death threats in recent days, CNN has learned. Citing an internal law enforcement report that detail… [+2023 chars]","Both Brett Kavanaugh and Christine Blasey Ford, the professor who has accused of him of sexual assault as a teenager, have received a slew of death threats in recent days, CNN has learned.",left,2018-09-20T20:09:03Z,cnn,CNN,Brett Kavanaugh and Christine Blasey Ford receiving death threats,https://www.cnn.com/2018/09/20/politics/kavanaugh-ford-death-threats/index.html,https://cdn.cnn.com/cnnnext/dam/assets/180917095116-blasey-ford-kavanaugh-split-super-tease.jpg
325,"Kate Sullivan, CNN","Washington (CNN) The White House and Supreme Court nominee Brett Kavanaugh denied an allegation Sunday made by a second woman accusing him of inappropriate sexual behavior. Ronan Farrow and Jane Mayer of The New Yorker reported Sunday that Deborah Ramirez, 53… [+3550 chars]",The White House and Supreme Court nominee Brett Kavanaugh denied an allegation Sunday made by a second woman accusing him of inappropriate sexual behavior.,left,2018-09-24T02:10:14Z,cnn,CNN,White House and Kavanaugh deny allegation made by second woman,https://www.cnn.com/2018/09/23/politics/kavanaugh-allegation-second-woman/index.html,https://cdn.cnn.com/cnnnext/dam/assets/180923144849-brett-kavanaugh-09-19-super-tease.jpg
