,author,content,description,label,publishedAt,source_id,source_name,title,url,urlToImage
892,,"WHEN Clarence Thomas, rigid with anger, accused the Senate judiciary committee of subjecting him to a “high-tech lynching for uppity blacks”, white America winced. Late in the process to confirm Mr Thomas’s appointment to the Supreme Court bench, he had been … [+6042 chars]","WHEN Clarence Thomas, rigid with anger, accused the Senate judiciary committee of subjecting him to a “high-tech lynching for uppity blacks”, white America winced. Late in the process to confirm Mr Thomas’s appointment to the Supreme Court bench, he had been …",center,2018-09-20T14:46:34Z,the-economist,The Economist,Kavanaugh and #MeToo,https://www.economist.com/united-states/2018/09/22/kavanaugh-and-metoo,https://cdn.static-economist.com/sites/default/files/images/2018/09/articles/main/20180922_usd000.png
893,,"ON SEPTEMBER 16th America learned the identity of a woman who says she was assaulted by Brett Kavanaugh, President Donald Trump's pick for the Supreme Court, while in high school. Christine Blasey Ford, a psychology professor in California, told the Washingto… [+4587 chars]",His accuser may testify before the Senate Judiciary Committee this week,center,2018-09-17T14:47:35Z,the-economist,The Economist,Will an allegation of assault jeopardise Brett Kavanaugh’s confirmation?,https://www.economist.com/democracy-in-america/2018/09/17/will-an-allegation-of-assault-jeopardise-brett-kavanaughs-confirmation,https://cdn.static-economist.com/sites/default/files/20180922_USP501.jpg
894,,"ABORTION-RIGHTS activists, concerned about how Brett Kavanaugh, President Donald Trump’s pick for the Supreme Court, regards Roe v Wade, now have a new worry. On September 10th, a three-judge panel on the Eighth Circuit Court of Appeals vacated a lower-court … [+4919 chars]",The Supreme Court had ruled that a more modest version of the regulations in Texas constituted an infringement of a woman’s right to choose,center,2018-09-12T05:11:39Z,the-economist,The Economist,An appeals court says Missouri can enforce tough abortion laws,https://www.economist.com/democracy-in-america/2018/09/12/an-appeals-court-says-missouri-can-enforce-tough-abortion-laws,https://cdn.static-economist.com/sites/default/files/20180915_USP502.jpg
895,,"WHEN Barack Obama created the Deferred Action for Childhood Arrivals (DACA), in 2012, he said his executive action would “lift the shadow of deportation” from people brought to America illegally as children. Donald Trump campaigned against the programme, sayi… [+5556 chars]",America's highest court will probably step in if a Texas judge blocks the programme's protections,center,2018-08-27T17:47:36Z,the-economist,The Economist,Is DACA heading for the Supreme Court?,https://www.economist.com/democracy-in-america/2018/08/27/is-daca-heading-for-the-supreme-court,https://cdn.static-economist.com/sites/default/files/20180901_blp905.jpg
896,,"WHEN the Supreme Court passed up several opportunities to rein in partisan gerrymandering, Justice Anthony Kennedy’s purported reticence was the main story. Justice Kennedy, now retired, had all but invited these cases in a 2004 decision decrying state legisl… [+6478 chars]",A new ruling on the state's gerrymandered map may prompt quick action from the Supreme Court,center,2018-08-29T15:31:54Z,the-economist,The Economist,Will North Carolina get a new election map before the mid-terms?,https://www.economist.com/democracy-in-america/2018/08/29/will-north-carolina-get-a-new-election-map-before-the-mid-terms,https://cdn.static-economist.com/sites/default/files/20180901_USP503.jpg
897,,"THE judiciary, wrote Alexander Hamilton in Federalist Paper 78, “may truly be said to have neither FORCE nor WILL, but merely judgment...[It] is beyond comparison the weakest of the three departments of power.” For much of American history, politicians saw th… [+4772 chars]","THE judiciary, wrote Alexander Hamilton in Federalist Paper 78, “may truly be said to have neither FORCE nor WILL, but merely judgment...[It] is beyond comparison the weakest of the three departments of power.” For much of American history, politicians saw th…",center,2018-09-13T14:54:59Z,the-economist,The Economist,America’s highest court needs term limits,https://www.economist.com/leaders/2018/09/15/americas-highest-court-needs-term-limits,https://cdn.static-economist.com/sites/default/files/images/print-edition/20180915_LDP001_0.jpg
898,https://www.facebook.com/DailyMail,"Cynthia Nixon has opened up about her mother's illegal abortion, in an effort to highlight the bleak future some could face if the procedure were criminalized or restricted again. Nixon, 52, explained in a new video released on Tuesday as part of her run for … [+5217 chars]","Nixon, 52, explained in a new video released on Tuesday as part of her run for New York governor that her mother Anne Knoll Nixon, who died in 2013, had an abortion when it was still illegal.",right,2018-09-05T20:10:27Z,daily-mail,Daily Mail,Cynthia Nixon opens up about her mother's illegal abortion,http://www.dailymail.co.uk/femail/article-6135577/Cynthia-Nixon-opens-mothers-illegal-abortion.html,https://i.dailymail.co.uk/i/newpix/2018/09/05/19/4FBE2A9300000578-0-image-a-103_1536170505926.jpg
899,https://www.facebook.com/DailyMail,"Senate Majority leader Mitch McConnell said Monday that all 100 senators will soon vote on President Donald Trump 's embattled Supreme Court nominee Brett Kavanaugh, no matter what results from a closely watched Judiciary Committee set for Thursday. 'Judge Ka… [+1751 chars]","McConnell says all 100 senators will soon vote on Trump's embattled Supreme Court nominee, no matter what results from a closely watched Judiciary Committee set for Thursday.",right,2018-09-24T19:51:13Z,daily-mail,Daily Mail,Mitch McConnell says Kavanaugh WILL get a vote on the Senate floor no matter what,https://www.dailymail.co.uk/news/article-6203203/Mitch-McConnell-says-Kavanaugh-vote-Senate-floor-no-matter-what.html,https://i.dailymail.co.uk/i/newpix/2018/09/24/20/509EAA1700000578-0-image-a-3_1537817875594.jpg
900,http://www.dailymail.co.uk/home/search.html?s=&authornamef=Associated+Press,"WASHINGTON (AP) - The Latest on Supreme Court nominee Brett Kavanaugh (all times local): 8:45 p.m. Supreme Court nominee Brett Kavanaugh said in a newly released White House email that limits on campaign contributions to candidates ""have some constitutional p… [+1580 chars]",WASHINGTON (AP) - The Latest on Supreme Court nominee Brett Kavanaugh (all times local):8:45 p.m.Supreme Court nominee Brett Kavanaugh said in a newly...,right,2018-09-01T00:49:03Z,daily-mail,Daily Mail,The Latest: Kavanaugh questioned campaign contribution...,http://www.dailymail.co.uk/wires/ap/article-6120671/The-Latest-Kavanaugh-questioned-campaign-contribution-caps.html,https://i.dailymail.co.uk/i/pix/m_logo_636x382px.png
901,http://www.dailymail.co.uk/home/search.html?s=&authornamef=Associated+Press,WASHINGTON (AP) - The Latest on the Senate hearings on Supreme Court nominee Brett Kavanaugh (all times local): 3:08 p.m. Newly obtained emails show that Brett Kavanaugh told friends to keep what transpired on a weekend sailing trip in 2001 confidential. Afte… [+8928 chars],WASHINGTON (AP) - The Latest on the Senate hearings on Supreme Court nominee Brett Kavanaugh (all times local):3:08 p.m.Newly obtained emails show that Brett...,right,2018-09-06T19:14:52Z,daily-mail,Daily Mail,The Latest: Kavanaugh wanted 2001 sailing trip kept secret,http://www.dailymail.co.uk/wires/ap/article-6140409/The-Latest-Kavanaugh-wanted-2001-sailing-trip-kept-secret.html,https://i.dailymail.co.uk/1s/2018/09/06/20/wire-4199040-1536261278-402_636x382.jpg
902,http://www.dailymail.co.uk/home/search.html?s=&authornamef=Associated+Press,WASHINGTON (AP) - The Latest on the Senate hearings on Supreme Court nominee Brett Kavanaugh (all times local): 11:35 a.m. Supreme Court nominee Brett Kavanaugh says he knew nothing about the sexual misconduct allegations against a judge who was a friend and … [+9491 chars],WASHINGTON (AP) - The Latest on the Senate hearings on Supreme Court nominee Brett Kavanaugh (all times local):11:35 a.m.Supreme Court nominee Brett...,right,2018-09-05T15:39:55Z,daily-mail,Daily Mail,The Latest: Kavanaugh denies knowing of Kozinski...,http://www.dailymail.co.uk/wires/ap/article-6135223/The-Latest-Kavanaugh-denies-knowing-Kozinski-complaints.html,https://i.dailymail.co.uk/1s/2018/09/05/16/wire-4184564-1536161962-569_636x382.jpg
903,http://www.dailymail.co.uk/home/search.html?s=&authornamef=Press+Association,"US Supreme Court nominee Brett Kavanaugh has rejected repeated requests at a Senate confirmation hearing to reveal his views about a president pardoning himself or being forced to testify in a criminal case. For a second day, the judge nominated by Donald Tru… [+4872 chars]",Brett Kavanaugh was questioned by senators at a confirmation hearing.,right,2018-09-06T08:24:24Z,daily-mail,Daily Mail,Supreme Court nominee´s lips sealed on White House...,http://www.dailymail.co.uk/wires/pa/article-6138033/Supreme-Court-nominee-s-lips-sealed-White-House-subpoenas-pardons.html,https://i.dailymail.co.uk/1s/2018/09/06/09/wire-4193138-1536222253-110_636x382.jpg
904,http://www.dailymail.co.uk/home/search.html?s=&authornamef=Associated+Press,"WASHINGTON (AP) - Judge Brett Kavanaugh is treading carefully during his confirmation hearing as senators bombard him with questions about abortion, presidential power and the independence of the judiciary. Some highlights from the Supreme Court nominee' conf… [+4315 chars]","WASHINGTON (AP) - Judge Brett Kavanaugh is treading carefully during his confirmation hearing as senators bombard him with questions about abortion,...",right,2018-09-05T19:34:37Z,daily-mail,Daily Mail,"Treading carefully, Kavanaugh dodges confirmation...",http://www.dailymail.co.uk/wires/ap/article-6136133/Treading-carefully-Kavanaugh-dodges-confirmation-minefields.html,https://i.dailymail.co.uk/1s/2018/09/05/20/wire-4187036-1536176060-521_636x382.jpg
905,http://www.dailymail.co.uk/home/search.html?s=&authornamef=Reuters,"By Lawrence Hurley and Ginger Gibson WASHINGTON, Sept 5 (Reuters) - Brett Kavanaugh, President Donald Trump's Supreme Court nominee, underscored the importance of judicial independence on Wednesday during the second day of his U.S. Senate confirmation hearing… [+5174 chars]","By Lawrence Hurley and Ginger GibsonWASHINGTON, Sept 5 (Reuters) - Brett Kavanaugh, President  Donald Trump's Supreme Court nominee, underscored the...",right,2018-09-05T16:09:33Z,daily-mail,Daily Mail,Trump's Supreme Court nominee emphasizes judicial...,http://www.dailymail.co.uk/wires/reuters/article-6135353/Trumps-Supreme-Court-nominee-emphasizes-judicial-independence.html,https://i.dailymail.co.uk/i/pix/m_logo_636x382px.png
906,https://www.facebook.com/DailyMail,"A senator who grilles Brett Kavanaugh during his confirmation hearing has gone viral. Kamala Harris, a Democratic senator from California, asked Kavanaugh, 53, several questions on Thursday during his confirmation hearing. Harris, 53, brought up several topic… [+4150 chars]","Kamala Harris, a Democratic senator from California, asked Kavanaugh, 53, several questions on Thursday during his confirmation hearing.",right,2018-09-07T16:22:18Z,daily-mail,Daily Mail,Senator Kamala Harris goes viral after grilling Brett Kavanaugh,http://www.dailymail.co.uk/femail/article-6143487/Senator-Kamala-Harris-goes-viral-grilling-Brett-Kavanaugh.html,https://i.dailymail.co.uk/i/newpix/2018/09/07/16/4FD7859000000578-0-image-a-71_1536333322604.jpg
907,https://www.facebook.com/DailyMail,"At 1pm, thousands of people across the US walked out of their schools and places of work in protest of Supreme Court nominee Brett Kavanaugh. The demonstration, called the #BelieveSurvivors walkout, was organized to send a message that many people are against… [+7913 chars]","Today, Americans walked out of businesses and schools as part of a  demonstration called #BelieveSurvivors. They're protesting and walking out in support of Dr. Christine Blasey Ford .",right,2018-09-24T20:26:46Z,daily-mail,Daily Mail,Celebs who joined the #BelieveSurvivors protests,https://www.dailymail.co.uk/femail/article-6202985/Celebs-joined-BelieveSurvivors-protests.html,https://i.dailymail.co.uk/i/newpix/2018/09/24/19/509E196200000578-0-image-a-141_1537814573424.jpg
908,http://www.dailymail.co.uk/home/search.html?s=&authornamef=Reuters,"By Lawrence Hurley and Amanda Becker WASHINGTON, Sept 6 (Reuters) - Democrats pressed Brett Kavanaugh, President Donald Trump's U.S. Supreme Court pick, over newly released emails highlighting his views on abortion and race issues on Thursday during his Senat… [+5476 chars]","By Lawrence Hurley and Amanda BeckerWASHINGTON, Sept 6 (Reuters) - Democrats pressed Brett  Kavanaugh, President Donald Trump's U.S. Supreme Court pick, ...",right,2018-09-06T20:54:35Z,daily-mail,Daily Mail,Democrats press Trump's Supreme Court pick over new...,http://www.dailymail.co.uk/wires/reuters/article-6140739/Democrats-press-Trumps-Supreme-Court-pick-new-documents.html,https://i.dailymail.co.uk/i/pix/m_logo_636x382px.png
909,http://www.dailymail.co.uk/home/search.html?s=&authornamef=Press+Association,"The governor of Arizona has announced that a former senator will fill the late John McCain’s US Senate seat but said he has only committed to serve until the end of the year. Jon Kyl, a Republican who retired from the Senate in 2012 to become a lobbyist and s… [+4192 chars]",Jon Kyl is currently shepherding President Donald Trump´s nomination of Brett Kavanaugh to the US Supreme Court.,right,2018-09-04T20:34:31Z,daily-mail,Daily Mail,Former senator to replace John McCain until end of year,http://www.dailymail.co.uk/wires/pa/article-6131913/Former-senator-replace-John-McCain-end-year.html,https://i.dailymail.co.uk/1s/2018/09/04/21/wire-4174688-1536093262-258_636x382.jpg
910,http://www.dailymail.co.uk/home/search.html?s=&authornamef=Associated+Press,WASHINGTON (AP) - The Latest on the Senate hearings on Supreme Court nominee Brett Kavanaugh (all times local): 9:20 a.m. Liberal and progressive groups are pressuring Senate Minority Leader Chuck Schumer to unify Democrats against Supreme Court nominee Brett… [+3834 chars],WASHINGTON (AP) - The Latest on the Senate hearings on Supreme Court nominee Brett Kavanaugh (all times local):9:20 a.m.Liberal and progressive groups are...,right,2018-09-05T13:30:03Z,daily-mail,Daily Mail,The Latest: Liberals urge Dems to unify against Kavanaugh,http://www.dailymail.co.uk/wires/ap/article-6134617/The-Latest-Liberals-urge-Dems-unify-against-Kavanaugh.html,https://i.dailymail.co.uk/1s/2018/09/05/14/wire-4183120-1536154460-65_636x382.jpg
911,http://www.dailymail.co.uk/home/search.html?s=&authornamef=Associated+Press,WASHINGTON (AP) - The Latest on confirmation hearings for Supreme Court nominee Brett Kavanaugh (all times local): 9:50 a.m. Senators have begun the fourth and final day of confirmation hearings for Supreme Court nominee Brett Kavanaugh. Supreme Court nominee… [+3691 chars],WASHINGTON (AP) - The Latest on confirmation hearings for Supreme Court nominee Brett Kavanaugh (all times local):9:50 a.m.Senators have begun the fourth and...,right,2018-09-07T14:06:02Z,daily-mail,Daily Mail,The Latest: Senators begin final day of Kavanaugh hearings,http://www.dailymail.co.uk/wires/ap/article-6143329/The-Latest-Senators-begin-final-day-Kavanaugh-hearings.html,https://i.dailymail.co.uk/1s/2018/09/07/15/wire-4208046-1536329138-897_636x382.jpg
912,http://www.dailymail.co.uk/home/search.html?s=&authornamef=Associated+Press,"WASHINGTON (AP) - Some Democratic senators weighing 2020 presidential campaigns have seized upon the opening moments of Supreme Court nominee Brett Kavanaugh's Senate confirmation hearings. Democrats on the Senate Judiciary Committee, including Kamala (KAH'-m… [+988 chars]",WASHINGTON (AP) - Some Democratic senators weighing 2020 presidential campaigns have seized upon the opening moments of Supreme Court nominee Brett...,right,2018-09-04T16:59:26Z,daily-mail,Daily Mail,Potential 2020 Democrats seize on Kavanaugh Senate...,http://www.dailymail.co.uk/wires/ap/article-6131199/Potential-2020-Democrats-seize-Kavanaugh-Senate-hearings.html,https://i.dailymail.co.uk/1s/2018/09/04/18/wire-4172876-1536080771-985_636x382.jpg
913,http://www.dailymail.co.uk/home/search.html?s=&authornamef=Associated+Press,"WASHINGTON (AP) - President Donald Trump's second Supreme Court nominee, Brett Kavanaugh, is finishing two marathon days of questioning from senators. Some referred to it as the ""last job interview"" the 53-year-old appeals court judge will ever have, if, as e… [+5659 chars]","WASHINGTON (AP) - President Donald Trump's second Supreme Court nominee, Brett Kavanaugh, is finishing two marathon days of questioning from senators. Some...",right,2018-09-07T00:20:14Z,daily-mail,Daily Mail,5 takeaways: Kavanaugh's Supreme Court confirmation...,http://www.dailymail.co.uk/wires/ap/article-6141345/5-takeaways-Kavanaughs-Supreme-Court-confirmation-hearing.html,https://i.dailymail.co.uk/1s/2018/09/07/01/wire-4201618-1536279599-217_636x382.jpg
914,http://www.dailymail.co.uk/home/search.html?s=&authornamef=Associated+Press,"WASHINGTON (AP) - Supreme Court nominee Brett Kavanaugh repeatedly stressed the importance of judicial independence on the second day of his confirmation hearing Wednesday as he faced questioning from senators, including Democrats who fear he would be Preside… [+10044 chars]",WASHINGTON (AP) - Supreme Court nominee Brett Kavanaugh repeatedly stressed the importance of judicial independence on the second day of his confirmation...,right,2018-09-05T16:50:13Z,daily-mail,Daily Mail,"Kavanaugh stresses independence, won't discuss WH...",http://www.dailymail.co.uk/wires/ap/article-6135537/Kavanaugh-stresses-independence-wont-discuss-WH-subpoenas.html,https://i.dailymail.co.uk/1s/2018/09/05/17/wire-4185382-1536166172-975_636x382.jpg
915,http://www.dailymail.co.uk/home/search.html?s=&authornamef=Associated+Press,"WASHINGTON (AP) - Supreme Court nominee Brett Kavanaugh repeatedly stressed the importance of judicial independence on the second day of his confirmation hearing Wednesday as he faced questioning from senators, including Democrats who fear he would be Preside… [+10907 chars]",WASHINGTON (AP) - Supreme Court nominee Brett Kavanaugh repeatedly stressed the importance of judicial independence on the second day of his confirmation...,right,2018-09-05T18:44:50Z,daily-mail,Daily Mail,"Kavanaugh stresses independence, won't discuss WH...",http://www.dailymail.co.uk/wires/ap/article-6135989/Kavanaugh-stresses-independence-wont-discuss-WH-subpoenas.html,https://i.dailymail.co.uk/1s/2018/09/05/19/wire-4186530-1536173060-112_636x382.jpg
916,http://www.dailymail.co.uk/home/search.html?s=&authornamef=Associated+Press,"WASHINGTON (AP) - The Latest on the Senate hearings on Supreme Court nominee Brett Kavanaugh (all times local): 6:45 a.m. President Donald Trump's Supreme Court nominee says a good judge must be like a neutral and impartial umpire. In this Aug. 7, 2018, photo… [+2462 chars]",WASHINGTON (AP) - The Latest on the Senate hearings on Supreme Court nominee Brett Kavanaugh (all times local):6:45 a.m.President Donald Trump's Supreme...,right,2018-09-04T11:04:36Z,daily-mail,Daily Mail,The Latest: Kavanaugh says he's 'pro-law' judge,http://www.dailymail.co.uk/wires/ap/article-6129843/The-Latest-Kavanaugh-says-hes-pro-law-judge.html,https://i.dailymail.co.uk/1s/2018/09/04/12/wire-4169524-1536059064-117_636x382.jpg
917,http://www.dailymail.co.uk/home/search.html?s=&authornamef=Reuters,"By Lawrence Hurley WASHINGTON, Sept 5 (Reuters) - Brett Kavanaugh, President Donald Trump's U.S. Supreme Court nominee, sought to stake out his independence on Wednesday as he faced his first questions during the second day of his contentious Senate confirmat… [+3627 chars]","By Lawrence HurleyWASHINGTON, Sept 5 (Reuters) - Brett Kavanaugh, President  Donald Trump's U.S. Supreme Court nominee, sought to stake out  his independence...",right,2018-09-05T14:04:36Z,daily-mail,Daily Mail,Trump's Supreme Court nominee emphasizes judicial...,http://www.dailymail.co.uk/wires/reuters/article-6134783/Trumps-Supreme-Court-nominee-emphasizes-judicial-independence.html,https://i.dailymail.co.uk/i/pix/m_logo_636x382px.png
918,http://www.dailymail.co.uk/home/search.html?s=&authornamef=Associated+Press,"CINCINNATI (AP) - Supreme Court nominee Brett Kavanaugh has frequently supported giving the U.S. government wide latitude in the name of national security, including the secret collection of personal data from Americans. It's a subject Democrats plan to grill… [+7534 chars]","CINCINNATI (AP) - Supreme Court nominee Brett Kavanaugh has frequently supported giving the U.S. government wide latitude in the name of national security,...",right,2018-08-28T04:39:09Z,daily-mail,Daily Mail,Kavanaugh's support for surveilling Americans raises...,http://www.dailymail.co.uk/wires/ap/article-6104873/Kavanaughs-support-surveilling-Americans-raises-concern.html,https://i.dailymail.co.uk/1s/2018/08/28/05/wire-4093726-1535431141-830_636x382.jpg
919,http://www.dailymail.co.uk/home/search.html?s=&authornamef=Associated+Press,"WASHINGTON (AP) - Senators will launch a final round of questioning of Brett Kavanaugh on Thursday, but after a marathon 12-hour session, President Donald Trump's nominee to the Supreme Court appears to have avoided any major missteps that could trip his conf… [+7145 chars]","WASHINGTON (AP) - Senators will launch a final round of questioning of Brett Kavanaugh on Thursday, but after a marathon 12-hour session, President Donald...",right,2018-09-06T04:36:51Z,daily-mail,Daily Mail,Kavanaugh faces final round of questioning without...,http://www.dailymail.co.uk/wires/ap/article-6137491/Kavanaugh-faces-final-round-questioning-without-missteps.html,https://i.dailymail.co.uk/1s/2018/09/06/05/wire-4191500-1536208585-348_636x382.jpg
920,http://www.dailymail.co.uk/home/search.html?s=&authornamef=Reuters,"By Lawrence Hurley WASHINGTON, Sept 6 (Reuters) - Supreme Court nominee Brett Kavanaugh will face a final barrage of questions on Thursday in a multi-day U.S. Senate confirmation hearing, as Democrats press him on his independence from the man who nominated h… [+3177 chars]","By Lawrence HurleyWASHINGTON, Sept 6 (Reuters) - Supreme Court nominee Brett  Kavanaugh will face a final barrage of questions on Thursday in  a multi-day...",right,2018-09-06T10:04:37Z,daily-mail,Daily Mail,"Ducking queries on Trump, Supreme Court nominee resumes...",http://www.dailymail.co.uk/wires/reuters/article-6138359/Ducking-queries-Trump-Supreme-Court-nominee-resumes-U-S-Senate-test.html,https://i.dailymail.co.uk/i/pix/m_logo_636x382px.png
921,http://www.dailymail.co.uk/home/search.html?s=&authornamef=Associated+Press,"WASHINGTON (AP) - Supreme Court nominee Brett Kavanaugh promised Tuesday to be a ""team player"" if confirmed to the closely divided court, declaring that he will be a ""pro-law judge"" who won't decide cases based on his personal views. With Republicans hoping t… [+5335 chars]","WASHINGTON (AP) - Supreme Court nominee Brett Kavanaugh promised Tuesday to be a ""team player"" if confirmed to the closely divided court, declaring that he...",right,2018-09-04T12:00:33Z,daily-mail,Daily Mail,Kavanaugh pledges to be 'team player' on Supreme Court,http://www.dailymail.co.uk/wires/ap/article-6130065/Kavanaugh-pledges-team-player-Supreme-Court.html,https://i.dailymail.co.uk/1s/2018/09/04/13/wire-4169968-1536062423-849_636x382.jpg
922,http://www.dailymail.co.uk/home/search.html?s=&authornamef=Associated+Press,"WASHINGTON (AP) - Neil Gorsuch and Brett Kavanaugh first crossed paths over plates of beef stroganoff, shepherd's pie and chicken cubes in a thick, yellow sauce. They weren't business meals. They shared lunch period at their elite private high school. Now, th… [+5513 chars]","WASHINGTON (AP) - Neil Gorsuch and Brett Kavanaugh first crossed paths over plates of beef stroganoff, shepherd's pie and chicken cubes in a thick, yellow...",right,2018-08-24T04:53:49Z,daily-mail,Daily Mail,"Decades of 'Fancy meeting you here!' for Gorsuch,...",http://www.dailymail.co.uk/wires/ap/article-6093477/Decades-Fancy-meeting-Gorsuch-Kavanaugh.html,https://i.dailymail.co.uk/i/pix/m_logo_636x382px.png
923,http://www.dailymail.co.uk/home/search.html?s=&authornamef=Associated+Press,"Seeking confirmation to a federal judgeship after years of Democratic opposition, Brett Kavanaugh turned to one of his most powerful mentors for a boost. Judge Alex Kozinski, of the 9th U.S. Circuit Court of Appeals in California, traveled to Washington, D.C.… [+6555 chars]","Seeking confirmation to a federal judgeship after years of Democratic opposition, Brett Kavanaugh turned to one of his most powerful mentors for a...",right,2018-08-29T17:10:23Z,daily-mail,Daily Mail,Kavanaugh's ties to disgraced mentor loom over...,http://www.dailymail.co.uk/wires/ap/article-6111307/Kavanaughs-ties-disgraced-mentor-loom-confirmation.html,https://i.dailymail.co.uk/1s/2018/08/29/18/wire-4110460-1535562615-784_636x382.jpg
