,author,content,description,medium,publishedAt,source_id,source_name,title,url,urlToImage,polarity,length,article_similarity,source_similarity,cosine_similarity,subject_matter,cluster
53,THE EDITORIAL BOARD,"Then there are the persistent doubts about his truthfulness in telling senators in 2006 that he had no knowledge of Mr. Bush’s warrantless wiretapping program or his detainee treatment policy — claims that have been called into question by yet more emails, wh… [+1979 chars]",A perfect nominee for a president with no clear relation to the truth.,text,2018-09-07T23:56:02Z,the-new-york-times,The New York Times,Confirmed: Brett Kavanaugh Can’t Be Trusted,https://www.nytimes.com/2018/09/07/opinion/editorials/brett-kavanaugh-confirmation-hearings.html,https://static01.nyt.com/images/2018/09/07/opinion/07kavanaugh/07kavanaugh-facebookJumbo.jpg,0.3675486991733564,14,0.9769276214901972,0.574838654397996,0.8829661114909159,6,3
54,CHARLIE SAVAGE and JONATHAN WEISMAN,"The documents do not indicate how Judge Kavanaugh would rule, but they are fodder for Democratic questioning. Thank you for your submission. [ Read more about the documents, here. ] What do Democrats know that they can’t share? Late in Wednesday’s proceedings… [+2396 chars]","President Trump’s nominee to the Supreme Court, Judge Brett M. Kavanaugh, faces his third day of confirmation hearings on Thursday.",text,2018-09-06T13:46:37Z,the-new-york-times,The New York Times,Brett Kavanaugh Confirmation Hearings Day 3: Abortion Documents Take Center Stage,https://www.nytimes.com/2018/09/06/us/politics/brett-kavanaugh-confirmation-hearings.html,https://static01.nyt.com/images/2018/09/07/us/politics/07dc-kavanaughbriefing-sub/07dc-kavanaughbriefing-sub-facebookJumbo.jpg,0.0943533236442432,7,0.9845240719899758,0.30390014358051376,0.429173634155117,3,1
55,KATHERINE STEWART,"If your religion or deeply held moral beliefs include the view that all people should be treated with equal dignity, then this religious liberty won’t do anything for you. If you’re a taxpayer who helps to fund your local hospital, a patient who keeps it in b… [+3393 chars]","At his confirmation hearings, Brett Kavanaugh said just what religious conservatives — and Christian nationalists — wanted to hear.",text,2018-09-08T19:14:47Z,the-new-york-times,The New York Times,Whose Religious Liberty Is It Anyway?,https://www.nytimes.com/2018/09/08/opinion/kavanaugh-supreme-court-religious-liberty.html,https://static01.nyt.com/images/2018/09/08/opinion/08stewartWeb1/08stewartWeb1-facebookJumbo.jpg,0.1353103687522137,1,0.8530721317429835,0.2596009604888986,0.0979321354473155,2,1
56,EMILY COCHRANE,"In his opening remarks, Judge Kavanaugh vowed to uphold the attributes of an ideal judge and remain “a neutral and impartial arbiter who favors no litigant or policy.” Will any Republicans ask tough questions? Senator Jeff Flake, Republican of Arizona, critiq… [+2667 chars]",The Supreme Court nominee Judge Brett M. Kavanaugh during his confirmation hearing this week. The proceedings on Wednesday are the first chance that senators will have to question him under oath about his record and legal opinions.,text,2018-09-05T11:00:04Z,the-new-york-times,The New York Times,Live Briefing: What to Watch: Brett Kavanaugh Hearings Day 2,https://www.nytimes.com/2018/09/05/us/politics/brett-kavanaugh-hearing-live-updates.html,https://static01.nyt.com/images/2018/09/05/us/politics/05dc-kavanaughstatement/05dc-kavanaughstatement-facebookJumbo.jpg,0.43657107236406667,9,0.8205493478512603,0.32714246850553086,0.9703977933711603,8,1
57,https://www.facebook.com/bbcnews,Image copyright EPA Image caption Brett Kavanaugh insists judicial independence is key to the constitutional system US President Donald Trump's Supreme Court nominee has declined to say whether he thinks sitting presidents can be made to comply with a legal s… [+4413 chars],Trump's Supreme Court pick Brett Kavanaugh said he would not be drawn on a hypothetical question.,text,2018-09-05T22:25:27Z,bbc-news,BBC News,"Brett Kavanaugh, Supreme Court nominee, sidesteps subpoena question",https://www.bbc.co.uk/news/world-us-canada-45429016,https://ichef.bbci.co.uk/news/1024/branded_news/E2FF/production/_103311185_049074812.jpg,0.7713689891819182,18,0.4319752786262865,0.20634068559956253,0.7125238963207473,8,3
58,THE NEW YORK TIMES,"4 U.S. The Future of Roe v. Wade: 3 Scenarios, Explained",Judge Brett Kavanaugh faced questions from the Senate Judiciary Committee under oath about his legal opinions on major issues.,text,2018-09-06T01:11:26Z,the-new-york-times,The New York Times,"Kavanaugh Hearings Day 2: Abortion, Presidential Powers and Stolen Emails",https://www.nytimes.com/video/us/politics/100000006089401/kavanaugh-hearings-day-2-abortion-presidential-powers-and-stolen-emails.html,https://static01.nyt.com/images/2018/09/05/us/05Kavanaugh-hilitesvideo-still/merlin_143316954_bd0b0c23-00e9-4466-bdd4-5d8fc1933115-videoSixteenByNine1050.jpg,0.707794279123608,8,0.7443688154698659,0.25207114295162236,0.7229761641447763,3,2
59,CHARLIE SAVAGE and CATIE EDMONDSON,"[ Read more about the documents, here. ] Sparks fly over “committee confidential” documents Even as The Times were publishing secret emails involving Judge Kavanaugh, the Judiciary Committee chairman, Charles E. Grassley of Iowa, was trying to address Democra… [+3974 chars]",Protesters shout inside of Senate Judiciary Committee Chairman Charles E. Grassley’s office before Judge Brett Kavanaugh’s confirmation hearing on Thursday.,text,2018-09-06T14:12:46Z,the-new-york-times,The New York Times,Kavanugh Hearings Live Updates: Abortion Documents Take Center Stage,https://www.nytimes.com/2018/09/06/us/politics/kavanaugh-hearing-confirmation.html,https://static01.nyt.com/images/2018/09/07/us/politics/07dc-kavanaughbriefing-vidsub2/07dc-kavanaughbriefing-vidsub2-facebookJumbo.jpg,0.45703866695647855,6,0.36800253590406107,0.6712022798995606,0.28616634675153296,2,3
60,"JOUMANA KHATIB, STEPHEN REISS and SANDRA STEVENSON","10. Finally, after 13 years, Dorothy’s ruby slippers have been found. One of the famous pairs Judy Garland wore in “The Wizard of Oz” was stolen from a museum in Grand Rapids, Minn. Without fingerprints or surveillance video, the authorities were stumped. At … [+631 chars]",Here’s what you need to know at the end of the day.,text,2018-09-04T22:18:11Z,the-new-york-times,The New York Times,"Brett Kavanaugh, Colin Kaepernick, Amazon: Your Tuesday Evening Briefing",https://www.nytimes.com/2018/09/04/briefing/brett-kavanaugh-colin-kaepernick-amazon.html,https://static01.nyt.com/images/2018/09/04/briefing/20180904-promo/20180904-promo-facebookJumbo.jpg,0.19692404395349128,9,0.9659499002313854,0.47906069698291887,0.7948715301204183,1,3
61,DANIEL VICTOR,"• No news quiz this week It will return next Friday. • Ready for the weekend At the movies, we recommend “ Five Fingers for Marseilles,” a post-apartheid drama and western set in South Africa, and “ Blaze,” a biopic of the country singer Blaze Foley, directed… [+1227 chars]",Senators on the Judiciary Committee pressed Judge Brett Kavanaugh on Thursday about the constitutional right to abortion and his views on the special counsel.,text,2018-09-07T09:43:19Z,the-new-york-times,The New York Times,"Brett Kavanaugh, Burt Reynolds, North Korea: Your Friday Briefing",https://www.nytimes.com/2018/09/07/briefing/brett-kavanaugh-burt-reynolds-north-korea.html,https://static01.nyt.com/images/2018/09/07/us/politics/07us-ambriefing-kavanaugh-AMCORE/07us-ambriefing-kavanough-facebookJumbo.jpg,0.8530158696380763,11,0.5779326098707237,0.11441729116323751,0.10015206488677753,4,1
62,SHERYL GAY STOLBERG,It did not take long — just 13 words — for Senator Kamala Harris to jump in. The chairman of the Senate Judiciary Committee had just gaveled the first day of Judge Brett M. Kavanaugh’s confirmation hearings to order and was about to utter his 14th word when M… [+1073 chars],"From the moment Brett M. Kavanaugh’s confirmation hearings began, Senate Democrats eyeing a White House run in 2020 have used the live television event as a proving ground.",text,2018-09-06T15:39:16Z,the-new-york-times,The New York Times,Democrats Grilling Kavanaugh Have Their Eyes on 2020,https://www.nytimes.com/2018/09/06/us/politics/kavanaugh-hearings-kamala-harris-cory-booker.html,https://static01.nyt.com/images/2018/09/07/us/politics/07dc-2020-promo/07dc-2020-promo-facebookJumbo.jpg,0.500473609046463,14,0.42951984330750304,0.9594480057308085,0.8842144325801778,8,1
63,EMILY COCHRANE,"He will be introduced by Senator Rob Portman, Republican of Ohio; Condoleezza Rice, the former secretary of state; and Lisa Blatt, a self-described “ liberal Democrat and a feminist ” lawyer who has advocated Judge Kavanaugh’s confirmation. In defense of pres… [+3501 chars]",Judge Brett M. Kavanaugh will appear before the Senate Judiciary Committee on Tuesday to present himself and answer questions from lawmakers. Here’s what to watch.,text,2018-09-04T09:00:10Z,the-new-york-times,The New York Times,What to Watch: The First Day of Judge Kavanaugh’s Confirmation Hearings,https://www.nytimes.com/2018/09/04/us/politics/kavanaugh-confirmation-hearing-updates.html,https://static01.nyt.com/images/2018/08/23/us/politics/05dc-kavanaughbriefing/05dc-kavanaughbriefing-facebookJumbo-v2.jpg,0.5411363400580746,1,0.3307429235740704,0.6509455263232776,0.1739591919388822,4,3
64,MICHELLE GOLDBERG,"It’s fitting that last week’s Kavanaugh confirmation hearings were regularly interrupted by the sound of women screaming. Again and again, protesters, most of them female, cried out for the preservation of their rights, and were arrested. Republican men were … [+1375 chars]",A protester dressed as a character from “The Handmaid’s Tale” attended the first day of Brett Kavanaugh’s confirmation hearing last week.,text,2018-09-11T01:10:46Z,the-new-york-times,The New York Times,The Handmaid’s Court,https://www.nytimes.com/2018/09/10/opinion/columnists/kavanaugh-abortion-roe-v-wade-trump.html,https://static01.nyt.com/images/2018/09/10/opinion/10goldbergSub/10goldbergSub-facebookJumbo.jpg,0.9360887711484712,4,0.31454214995124474,0.44729250912721985,0.0030897191202170493,2,2
65,DANIEL VICTOR,"• Modeling in the #TimesUp era New York Fashion Week begins today, and all eyes are on how the industry has adapted after multiple scandals involving sexual assault and harassment. While some attitudes have shifted at the top of the fashion pyramid, change ha… [+1337 chars]",President Trump sought to assert command on Wednesday after an unsigned Op-Ed in The Times claimed that “unsung heroes” in the administration were putting country before president.,text,2018-09-06T09:45:47Z,the-new-york-times,The New York Times,"Donald Trump, Brett Kavanaugh, Theranos: Your Thursday Briefing",https://www.nytimes.com/2018/09/06/briefing/donald-trump-brett-kavanaugh-theranos.html,https://static01.nyt.com/images/2018/09/06/world/06USBriefing-amcore/06USBriefing-Trump-facebookJumbo.jpg,0.28274386379951544,5,0.6996111192484529,0.6542691688949923,0.720945385585755,5,2
66,CHARLIE SAVAGE and SHERYL GAY STOLBERG,"Insisting that his testimony had been “100 percent accurate,” Judge Kavanaugh said that in the early days after the Sept. 11, 2001, attacks, White House lawyers worked on many things related to national security, but he had never been “read into” the existenc… [+2808 chars]",Four days of Supreme Court confirmation hearings ended Friday the way they began: With fierce partisan divisions over Judge Brett M. Kavanaugh.,text,2018-09-07T23:48:59Z,the-new-york-times,The New York Times,"As Hearings End, Democrats Accuse Supreme Court Nominee of Dissembling",https://www.nytimes.com/2018/09/07/us/politics/brett-kavanaugh-confirmation-hearings.html,https://static01.nyt.com/images/2018/09/08/us/politics/08dc-kavanaugh-print/08dc-kavanaugh1-facebookJumbo.jpg,0.5335726664413522,5,0.4178126975849248,0.47631661219177013,0.39965382956475726,9,3
67,DAVID LEONHARDT,"“This is not the debate Republicans wanted to have,” James Wallner, a former Republican Senate staff member, tweeted yesterday morning. “Note: Kavanaugh hasn’t been debated once. It’s just the process, the documents. Democrats have framed this debate 100%.” A… [+1362 chars]","Judge Brett M. Kavanaugh, center, at his Senate confirmation hearing in Washington, D.C. For the most part, the day wasn’t about him.",text,2018-09-05T12:22:38Z,the-new-york-times,The New York Times,The Meaning of a Raucous Supreme Court Hearing,https://www.nytimes.com/2018/09/05/opinion/supreme-court-hearing-kavanaugh.html,https://static01.nyt.com/images/2018/09/05/opinion/05leonhardt-newsletter/merlin_143277474_64e6d77d-5b10-41dc-bc5c-1f9bbe21ebd5-facebookJumbo.jpg,0.4085672289613824,19,0.3419890732240636,0.11127604323395435,0.3633442248299702,5,2
68,SHERYL GAY STOLBERG and ADAM LIPTAK,"Republicans countered that Democrats were harping on access to documents because they could not quibble with Judge Kavanaugh’s qualifications. And they took digs at their Democratic colleagues on the judiciary panel, several of whom — Amy Klobuchar of Minneso… [+1464 chars]",Senator Charles E. Grassley swearing in the Supreme Court nominee Brett M. Kavanaugh during his confirmation hearing on Tuesday before the Senate Judiciary Committee.,text,2018-09-05T00:47:00Z,the-new-york-times,The New York Times,Democrats Open Contentious Hearings With Attack on ‘Partisan’ Kavanaugh,https://www.nytimes.com/2018/09/04/us/politics/kavanaugh-confirmation-supreme-court.html,https://static01.nyt.com/images/2018/09/05/us/politics/05dc-kavanaugh-sub/05dc-kavanaugh-sub-facebookJumbo.jpg,0.30966968089543223,17,0.9847487392053177,0.696613538616104,0.8698451988252368,4,2
69,,Chat with us in Facebook Messenger. Find out what's happening in the world as it unfolds.,Supreme Court nominee Brett Kavanaugh struggles to answer Sen. Kamala Harris' question on whether he discussed the Mueller investigation with anyone at Kasowitz Benson Torres.,text,2018-09-06T04:46:27Z,cnn,CNN,Senator challenges Kavanaugh on Mueller probe,https://www.cnn.com/videos/politics/2018/09/06/brett-kavanaugh-kamala-harris-mueller-investigation-sot-vpx.cnn,https://cdn.cnn.com/cnnnext/dam/assets/180906004156-kamala-harris-brett-kavanaugh-super-tease.jpg,0.09156705888017103,8,0.3036263927139935,0.6999991650998766,0.35557840442235134,4,3
70,JOUMANA KHATIB and MERRILL D. OLIVER,"5. Alex Jones is facing a reckoning. After news that Twitter had permanently banned his personal account and that of Infowars, his company, the big question is whether his hallmark bluster can see him out of his current peril. With tech giants — including Fac… [+304 chars]",Here’s what you need to know at the end of the day.,text,2018-09-07T22:08:08Z,the-new-york-times,The New York Times,"Brett Kavanaugh, George Papadopoulos, Elon Musk: Your Friday Evening Briefing",https://www.nytimes.com/2018/09/07/briefing/brett-kavanaugh-george-papadopoulos-elon-musk.html,https://static01.nyt.com/images/2018/09/09/us/0907_pmpromo/0907_pmpromo-facebookJumbo.jpg,0.6764415987504816,13,0.2449385202542136,0.3246264171358316,0.7922064173414284,9,2
71,,Chat with us in Facebook Messenger. Find out what's happening in the world as it unfolds.,"Sen. Richard Blumenthal (D-NY) grills Supreme Court nominee Brett Kavanaugh about President Trump's tweets saying Supreme Court Justice Ruth Bader Ginsburg's ""mind is shot.""",text,2018-09-06T21:19:48Z,cnn,CNN,Kavanaugh won't condemn Trump's Ginsburg tweets,https://www.cnn.com/videos/politics/2018/09/06/blumenthal-kavanaugh-trump-tweets-ginsburg-bts-vpx.cnn,https://cdn.cnn.com/cnnnext/dam/assets/180906171435-kavanaugh-09062018-super-tease.jpg,0.34578718909545114,14,0.2350926480000478,0.3095836566981526,0.549356919671525,5,2
72,,Chat with us in Facebook Messenger. Find out what's happening in the world as it unfolds.,Sen. Cory Booker (D-NJ) questions Supreme Court nominee Brett Kavanaugh about his loyalty to President Trump and how that could affect his decisions on the bench.,text,2018-09-07T00:31:14Z,cnn,CNN,Kavanaugh dodges question about Trump loyalty,https://www.cnn.com/videos/politics/2018/09/06/cory-booker-kavanaugh-trump-loyalty-bts-wolf-vpx.cnn,https://cdn.cnn.com/cnnnext/dam/assets/180906191528-booker-kavanaugh-2-super-tease.jpg,0.3966362689198544,12,0.9007625934889711,0.20210783210447425,0.4231295342211714,9,2
73,DANIEL VICTOR,"David Remnick, the magazine’s editor, initially defended Mr. Bannon’s participation, but he reconsidered after the withdrawals and a furor on social media. • Mr. Bannon called Mr. Remnick “gutless.” A final holdout in Syria • A looming assault on Idlib Provin… [+1281 chars]","Rebel soldiers in Idlib Province on Monday. The warring sides in Syria’s merciless civil war are preparing for another brutal offensive, and this one may be the last.",text,2018-09-04T09:54:44Z,the-new-york-times,The New York Times,"Brett Kavanaugh, Jeff Sessions, Colin Kaepernick: Your Tuesday Briefing",https://www.nytimes.com/2018/09/04/briefing/brett-kavanaugh-jeff-sessions-colin-kaepernick.html,https://static01.nyt.com/images/2018/09/04/world/04USBriefing-amcore/04USBriefing-Syria-facebookJumbo.jpg,0.5448836301025041,5,0.08286867489768734,0.539409527645139,0.40546591610266913,7,1
74,DANIEL VICTOR,"Listen to ‘The Daily’: Pandemonium, protesters and partisanship • Battle lines have been drawn in Supreme Court confirmation hearings. Listen on a computer, an iOS device or an Android device. Tech giants on Capitol Hill Executives from Facebook and Twitter w… [+1195 chars]","Ayanna Pressley with supporters in Dorchester, Mass., after her victory on Tuesday. “It seems like change is on the way,” she said.",text,2018-09-05T09:41:03Z,the-new-york-times,The New York Times,"Brett Kavanaugh, Bob Woodward, Amazon: Your Wednesday Briefing",https://www.nytimes.com/2018/09/05/briefing/brett-kavanaugh-bob-woodward-amazon.html,https://static01.nyt.com/images/2018/09/05/world/05USBriefing-amcore/05USBriefing-Pressley-facebookJumbo.jpg,0.7604427313350105,5,0.1972406222620552,0.5210769663083865,0.7365157047445138,4,1
75,CARL HULSE,"“Reviewing Judge Kavanaugh’s staff secretary documents would teach us nothing about his legal views,” Mr. Grassley said. The hearing is presenting a formidable challenge to Mr. Grassley, who over his long career has sought to cultivate a reputation for fairne… [+1303 chars]",Thirty years of warfare over judicial nominations culminated on Tuesday in the chaotic beginning of Senate consideration of the nomination of Judge Brett M. Kavanaugh to the Supreme Court.,text,2018-09-04T20:54:29Z,the-new-york-times,The New York Times,"On Washington: A New Reality for Court Confirmations: Pandemonium, Protesters and Partisanship",https://www.nytimes.com/2018/09/04/us/politics/kavanaugh-protests-confirmation-hearings.html,https://static01.nyt.com/images/2018/09/05/us/politics/05dc-hulse/05dc-hulse-facebookJumbo.jpg,0.47266834560738824,16,0.03247938134801487,0.4810053261444788,0.8922196939773828,5,2
76,The New York Times,"1 Business Day Elon Musk’s Highs and Lows: PayPal, SpaceX, Tesla","We have received lots of questions from our readers about abortion, classified documents and other issues raised during the confirmation hearings for Judge Brett Kavanaugh. The Times’s Supreme Court reporter, Adam Liptak, provides some answers.",text,2018-09-07T21:52:38Z,the-new-york-times,The New York Times,Answers to Your Questions About the Kavanaugh Hearings,https://www.nytimes.com/video/us/100000006090603/kavanaugh-hearings-abortion.html,https://static01.nyt.com/images/2018/09/06/autossell/kavanaugh3-78/kavanaugh3-78-videoSixteenByNine1050.jpg,0.22050115555830474,10,0.5900320076769088,0.8428196060926989,0.029104120747337037,5,1
77,"Joan Biskupic, CNN","(CNN) After a raucous Senate hearing during which he remained steady and now appears headed for confirmation, Judge Brett Kavanaugh will soon be positioned for immediate impact on the Supreme Court. The 53-year-old judge who grew up inside the Washington Belt… [+4914 chars]","After a raucous Senate hearing during which he remained steady and now appears headed for confirmation, Judge Brett Kavanaugh will soon be positioned for immediate impact on the Supreme Court.",text,2018-09-08T11:57:06Z,cnn,CNN,What we learned about Judge Kavanaugh,https://www.cnn.com/2018/09/08/politics/kavanaugh-future-supreme-court/index.html,https://cdn.cnn.com/cnnnext/dam/assets/180904172348-13-kavanaugh-hearings-0904-unfurled-super-tease.jpg,0.5947544888755567,19,0.5873968520077204,0.8812724588538888,0.9778261094363088,5,1
78,,Chat with us in Facebook Messenger. Find out what's happening in the world as it unfolds.,Supreme Court nominee Brett Kavanaugh delivers his opening statement to the Senate Judiciary Committee on the first day of his confirmation hearings.,text,2018-09-04T22:04:00Z,cnn,CNN,Hear Kavanaugh's opening statement,https://www.cnn.com/videos/politics/2018/09/04/brett-kavanaugh-opening-statement-confirmation-sot-lead-vpx.cnn,https://cdn.cnn.com/cnnnext/dam/assets/180904170550-13-kavanaugh-hearings-0904-unfurled-super-tease.jpg,0.5184923339348857,15,0.27837777590363133,0.378961498759235,0.8358779631174003,9,3
79,,Chat with us in Facebook Messenger. Find out what's happening in the world as it unfolds.,"Fred Guttenberg, the father of a slain Parkland student, said he tried to approach Supreme Court nominee Brett Kavanaugh only for the judge to ignore him. White House deputy press secretary Raj Shah addressed the moment on Twitter, saying, ""Before the Judge w…",text,2018-09-05T00:40:00Z,cnn,CNN,Parkland dad describes Kavanaugh interaction,https://www.cnn.com/videos/politics/2018/09/04/brett-kavanaugh-parkland-father-fred-guttenberg-handshake-erin-intv-bolduan-vpx.cnn,https://cdn.cnn.com/cnnnext/dam/assets/180904202312-fred-guttenberg-parkland-dad-intv-kavanaugh-super-tease.jpg,0.9344192771985405,3,0.20322859580836905,0.5611347026101167,0.41582628228443597,3,1
80,"MICHAEL D. SHEAR, ADAM LIPTAK and SHERYL GAY STOLBERG","Casey, which gave states the authority to regulate abortion so long as those regulations do not pose an “undue burden” on the woman, is “precedent on precedent,” he said. On that issue and others, Judge Kavanaugh repeatedly sought to demonstrate empathy, tell… [+1522 chars]","On his first full day of questioning, Judge Brett M. Kavanaugh, President Trump’s nominee to the Supreme Court, would not say whether a president could be subpoenaed or pardon himself.",text,2018-09-05T23:09:25Z,the-new-york-times,The New York Times,Kavanaugh Ducks Questions on Presidential Powers and Subpoenas,https://www.nytimes.com/2018/09/05/us/politics/brett-kavanaugh-hearing.html,https://static01.nyt.com/images/2018/09/06/us/politics/06dc-kavanaugh-jp-2-print/06dc-kavanaugh-1-facebookJumbo.jpg,0.8719692449663267,7,0.11825209172907791,0.04047781849326659,0.7553184255582271,3,1
81,MICHELLE GOLDBERG,"Kavanaugh denies the allegation unequivocally; on Monday he said he’s willing to rebut it before the Senate Judiciary Committee. (Judge, who wrote a memoir of his teenage alcoholism, has veered between denying the incident and saying he doesn’t recall it.) Bu… [+2743 chars]",Brett Kavanaugh on the third day of his confirmation hearing.,text,2018-09-17T21:54:19Z,the-new-york-times,The New York Times,Boys Will Be Supreme Court Justices,https://www.nytimes.com/2018/09/17/opinion/columnists/christine-blasey-ford-brett-kavanaugh-supreme-court-republicans.html,https://static01.nyt.com/images/2018/09/17/opinion/17goldbergWeb/17goldbergWeb-facebookJumbo.jpg,0.5002331939040527,3,0.706055973132463,0.030398205105506726,0.14592960779295994,1,1
82,ADAM LIPTAK,"“It was one of the greatest moments because of the political pressures of the time,” he said of the decision, United States v. Nixon. “The courts stood up for judicial independence in a moment of national crisis.” That ruling would, of course, figure in the r… [+1125 chars]",Judge Brett M. Kavanaugh spent a long day answering — and often failing to answer — questions about some of the most pressing issues that could reach the Supreme Court in the years ahead. Here’s a look at three of them.,text,2018-09-05T23:18:57Z,the-new-york-times,The New York Times,"What Kavanaugh’s Hearings Reveal About His Beliefs on Abortion, Guns and Presidential Power",https://www.nytimes.com/2018/09/05/us/politics/kavanaugh-abortion-guns-presidential-power.html,https://static01.nyt.com/images/2018/09/06/us/politics/06dc-issues-1/06dc-issues-1-facebookJumbo.jpg,0.5567398913566493,6,0.9814874379607759,0.30629476184369453,0.16974457437030355,9,1
83,"Kelly Murray, CNN",,A group of protesters bearing a message as stark as their red and white costumes are opposing Brett Kavanaugh's Supreme Court confirmation hearings.,text,2018-09-05T08:02:25Z,cnn,CNN,A silent protest with a very loud message: Stop Kavanaugh,https://www.cnn.com/2018/09/05/politics/kavanaugh-senate-hearing-handmaids-tale-protesters/index.html,https://cdn.cnn.com/cnnnext/dam/assets/180904233053-handmaids-tale-protesters-kavanaugh-02-super-tease.jpg,0.9239414748923788,12,0.7444609976238137,0.13193004569122457,0.951607100584889,5,2
