,author,content,description,medium,publishedAt,source_id,source_name,title,url,urlToImage,polarity,length,article_similarity,source_similarity,cosine_similarity,subject_matter,cluster
0,https://www.facebook.com/bbcnews,Image copyright EPA Image caption Brett Kavanaugh insists judicial independence is key to the constitutional system US President Donald Trump's Supreme Court nominee has declined to say whether he thinks sitting presidents can be made to comply with a legal s… [+4413 chars],Trump's Supreme Court pick Brett Kavanaugh said he would not be drawn on a hypothetical question.,text,2018-09-05T22:25:27Z,bbc-news,BBC News,"Brett Kavanaugh, Supreme Court nominee, sidesteps subpoena question",https://www.bbc.co.uk/news/world-us-canada-45429016,https://ichef.bbci.co.uk/news/1024/branded_news/E2FF/production/_103311185_049074812.jpg,0.07469526088278478,8,0.4321875849085076,0.25905004507483276,0.47837739879382335,9,1
1,https://www.facebook.com/bbcnews,"Image copyright Reuters Image caption Brett Kavanaugh denies the allegations A number of Republicans have said the vote on US President Donald Trump's Supreme Court nominee, Brett Kavanaugh, should be paused while allegations of sexual assault are properly he… [+3595 chars]",Senator Jeff Flake says the US Supreme Court vote should be paused until the alleged victim is heard.,text,2018-09-17T11:38:09Z,bbc-news,BBC News,Brett Kavanaugh: Republican senators call for vote delay,https://www.bbc.co.uk/news/world-us-canada-45546954,https://ichef.bbci.co.uk/news/1024/branded_news/DFEE/production/_103462375_63deb8cf-b686-4dc1-8c26-d5129c66f21b.jpg,0.2706516971163565,15,0.772028855506113,0.1004572156168585,0.6418105283040924,4,2
2,https://www.facebook.com/bbcnews,Image copyright Researchgate.net/ Getty Image caption Brett Kavanaugh denies the allegations by Christine Blasey Ford A woman who accuses Donald Trump's Supreme Court nominee Brett Kavanaugh of attempted rape has been given more time to decide whether she wil… [+3922 chars],"Christine Blasey Ford's lawyer accuses senators of ""arbitrary"" deadlines over the Kavanaugh hearing.",text,2018-09-22T05:35:40Z,bbc-news,BBC News,Brett Kavanaugh: Judge accuser 'given more time' for hearing,https://www.bbc.co.uk/news/world-us-canada-45609663,https://ichef.bbci.co.uk/news/1024/branded_news/C982/production/_103468515_untitleatq5435d-1.jpg,0.028915313323091385,15,0.5575901544660741,0.7889598254901513,0.4919653019786425,4,2
3,https://www.facebook.com/bbcnews,"Image copyright AFP/Getty Image caption Brett Kavanaugh, seen here during his US Senate Judiciary Committee confirmation hearing last week US President Donald Trump's Supreme Court nominee Brett Kavanaugh has denied an allegation of sexual misconduct during h… [+2444 chars]",The allegation against the US Supreme Court nominee dates back to when he was a high-school student.,text,2018-09-14T18:38:27Z,bbc-news,BBC News,Brett Kavanaugh denies sexual misconduct in high school,https://www.bbc.co.uk/news/world-us-canada-45527465,https://ichef.bbci.co.uk/news/1024/branded_news/16FFC/production/_103440249_mediaitem103440248.jpg,0.07301619516058988,10,0.09225903156860238,0.25551663304747074,0.9271893012283997,2,1
4,https://www.facebook.com/bbcnews,Image copyright Researchgate.net/ Getty Image caption Brett Kavanaugh denies the allegations by Christine Blasey Ford The woman who accuses US Supreme Court pick Brett Kavanaugh of sexual assault in 1982 has set out terms for her testifying before a Senate co… [+2940 chars],The woman accusing the US Supreme Court nominee of sexual assault sets out her terms for testifying.,text,2018-09-21T13:39:08Z,bbc-news,BBC News,Brett Kavanaugh accuser sets out terms for testimony,https://www.bbc.co.uk/news/world-us-canada-45603918,https://ichef.bbci.co.uk/news/1024/branded_news/C982/production/_103468515_untitleatq5435d-1.jpg,0.7008467881632118,1,0.9793368588284338,0.6464694179318092,0.41885648844676615,8,2
5,Sabrina Siddiqui in Washington,"Brett Kavanaugh, Donald Trump’s conservative nominee for the US supreme court, faced sharp questions on Capitol Hill on some of the hottest issues raging in American society – abortion, gun rights and presidential power – during the second day of his dramatic… [+4556 chars]","Trump’s supreme court nominee was grilled on abortion, gun rights and presidential power on the second day of his hearing Brett Kavanaugh, Donald Trump’s conservative nominee for the US supreme court, faced sharp questions on Capitol Hill on some of the hotte…",text,2018-09-05T18:14:46Z,the-guardian-au,The Guardian (AU),Brett Kavanaugh sidesteps Senate questions on Roe v Wade,https://www.theguardian.com/us-news/2018/sep/05/brett-kavanaugh-senate-abortion-supreme-court-roe-v-wade,https://i.guim.co.uk/img/media/e57aaa3036c25946379df85fdb33142ca2501b1b/0_66_6000_3600/master/6000.jpg?width=1200&height=630&quality=85&auto=format&usm=12&fit=crop&crop=faces%2Centropy&bm=normal&ba=bottom%2Cleft&blend64=aHR0cHM6Ly9hc3NldHMuZ3VpbS5jby51ay9pbWFnZXMvb3ZlcmxheXMvZDM1ODZhNWVmNTc4MTc1NmQyMWEzYjYzNWU1MTcxNDEvdGctZGVmYXVsdC5wbmc&s=97a89eee719b5a7fc70af6fe6518c139,0.9234408242936379,9,0.06255715617493851,0.2344642165968036,0.7308797321981421,8,2
6,https://www.facebook.com/robert.barnes.3139,The Senate Judiciary Committee on Tuesday begins what is expected to be a four-day hearing on President Trump’s nomination of Judge Brett M. Kavanaugh to be the Supreme Court’s 114th justice. The senators and Kavanaugh will make opening statements on Tuesday.… [+6201 chars],"Washington Post Who is Brett Kavanaugh, President Trump's pick for Supreme Court? Washington Post The Senate Judiciary Committee on Tuesday begins what is expected to be a four-day hearing on President Trump's nomination of Judge Brett M. Kavanaugh to be the …",text,2018-09-03T17:31:18Z,the-washington-post,The Washington Post,"Who is Brett Kavanaugh, President Trump's pick for Supreme Court? - Washington Post",https://www.washingtonpost.com/politics/courts_law/who-is-brett-kavanaugh/2018/09/03/d9226b68-af7d-11e8-a20b-5f4f84429666_story.html,https://www.washingtonpost.com/resizer/rLQM9y3RRXWsto6IFmJF30xIYB8=/1484x0/arc-anglerfish-washpost-prod-washpost.s3.amazonaws.com/public/GFVGRJVPRYI6RIQLL5HYIQUWMY.jpg,0.03561763105990945,6,0.3596568677025318,0.23084728916021235,0.89451896723153,9,1
7,Lawrence Hurley,"WASHINGTON (Reuters) - Supreme Court nominee Brett Kavanaugh will face a final barrage of questions on Thursday in a multi-day U.S. Senate confirmation hearing, as Democrats press him on his independence from the man who nominated him, President Donald Trump.… [+3085 chars]","Supreme Court nominee Brett Kavanaugh will face a final barrage of questions on Thursday in a multi-day U.S. Senate confirmation hearing, as Democrats press him on his independence from the man who nominated him, President Donald Trump.",text,2018-09-06T10:03:07Z,reuters,Reuters,"Ducking queries on Trump, Supreme Court nominee resumes U.S. Senate test",https://www.reuters.com/article/us-usa-court-kavanaugh/ducking-queries-on-trump-supreme-court-nominee-resumes-u-s-senate-test-idUSKCN1LM1A0,https://s1.reutersmedia.net/resources/r/?m=02&d=20180906&t=2&i=1301424697&w=1200&r=LYNXNPEE850V1,0.8287867784426355,2,0.57865484686242,0.5243697458533999,0.4066739025602709,2,2
8,https://www.facebook.com/bbcnews,"Image copyright Reuters Image caption Prof Ford says Brett Kavanaugh pinned her to a bed and tried to take off her clothes The woman who accuses US Supreme Court nominee Brett Kavanaugh of attempting to rape her will not testify to the Senate next week, says … [+1002 chars]","Christine Blasey Ford's attorney says her client has been ""deflecting death threats and harassment"".",text,2018-09-19T00:21:38Z,bbc-news,BBC News,Christine Blasey Ford: Kavanaugh accuser 'faces death threats',https://www.bbc.co.uk/news/world-us-canada-45568450,https://ichef.bbci.co.uk/news/1024/branded_news/13373/production/_103470787_hi049360823-1.jpg,0.008364909482899252,19,0.9487996015510336,0.6858819092079301,0.1531578417508197,9,3
9,,"Your usage has been flagged as a violation of our terms of service. For inquiries related to this message please contact support. For sales inquiries, please visit http://www.bloomberg.com/professional/request-demo If you believe this to be in error, please c… [+280 chars]",Bloomberg Democrats Poised to Grill Kavanaugh at Supreme Court Hearing Bloomberg Democrats spent the first day of Brett Kavanaugh's U.S. Supreme Court confirmation hearings criticizing Republicans. Now they will turn to the nominee himself. Kavanaugh closed o…,text,2018-09-05T08:15:39Z,bloomberg,Bloomberg,Democrats Poised to Grill Kavanaugh at Supreme Court Hearing - Bloomberg,https://www.bloomberg.com/tosv2.html?vid=&uuid=159156d0-b0f6-11e8-85e6-796dcb95fa70&url=L25ld3MvYXJ0aWNsZXMvMjAxOC0wOS0wNS9kZW1vY3JhdHMtcG9pc2VkLXRvLXF1ZXN0aW9uLWthdmFuYXVnaC1hcy1jb3VydC1oYW5ncy1pbi1iYWxhbmNl,,0.5743079582357092,14,0.03844338498332667,0.9992343542467371,0.8029070519898625,2,1
10,Lauren Gambino in Washington,,"Donald Trump’s pick, who could shift the top decisively to the right, begins his confirmation hearing before the Senate judiciary committee 3.03pm BST Democrats are arguing that they received “a 40,000 page document dump” on Monday night and have not had a ch…",text,2018-09-04T14:03:45Z,the-guardian-au,The Guardian (AU),Brett Kavanaugh: protesters disrupt supreme court nominee's Senate hearing – live,https://www.theguardian.com/law/live/2018/sep/04/brett-kavanaugh-supreme-court-senate-confirmation-hearing,https://i.guim.co.uk/img/media/23b642bbb668dec4a08428c608240bf722be1ca4/0_141_4230_2538/master/4230.jpg?width=1200&height=630&quality=85&auto=format&usm=12&fit=crop&crop=faces%2Centropy&bm=normal&ba=bottom%2Cleft&blend64=aHR0cHM6Ly9hc3NldHMuZ3VpbS5jby51ay9pbWFnZXMvb3ZlcmxheXMvZmQ2MTg4YTJlMWFhNThmNWM5Y2VkODlkNjQxOWU1OTgvdGctbGl2ZS5wbmc&s=2b656646f9b1f437333cf9457d3ba089,0.5103189448687036,18,0.28054727951025826,0.7257240424507325,0.3957546297080665,1,2
11,Reuters Editorial,"WASHINGTON (Reuters) - U.S. senators on Wednesday are set to probe Brett Kavanaugh, President Donald Trump’s nominee to fill a vacancy on the Supreme Court, over his views on abortion as his confirmation hearing moves into its second day. Here is why it matte… [+2552 chars]","U.S. senators on Wednesday are set to probe Brett Kavanaugh, President Donald Trump's nominee to fill a vacancy on the Supreme Court, over his views on abortion as his confirmation hearing moves into its second day. Here is why it matters:",text,2018-09-05T10:03:05Z,reuters,Reuters,Factbox: Kavanaugh's view on precedent central to U.S. abortion debate,https://www.reuters.com/article/us-usa-court-abortion-factbox/factbox-kavanaughs-view-on-precedent-central-to-u-s-abortion-debate-idUSKCN1LL14M,https://s3.reutersmedia.net/resources/r/?m=02&d=20180905&t=2&i=1300915923&w=1200&r=LYNXNPEE840MM,0.7993074251333275,18,0.5313459957452149,0.20955545421818578,0.5094673332633965,4,2
12,Reuters Editorial,"WASHINGTON (Reuters) - The late U.S. Senator John McCain’s seat was filled on Wednesday when Jon Kyl, a former senator, took the oath of office in time to help Republicans in their push to confirm Brett Kavanaugh to the U.S. Supreme Court. Kyl, 76, was sworn … [+1820 chars]","The late U.S. Senator John McCain's seat was filled on Wednesday when Jon Kyl, a former senator, took the oath of office in time to help Republicans in their push to confirm Brett Kavanaugh to the U.S. Supreme Court.",text,2018-09-05T17:38:54Z,reuters,Reuters,Jon Kyl sworn in as senator replacing McCain,https://www.reuters.com/article/us-usa-mccain/jon-kyl-sworn-in-as-senator-replacing-mccain-idUSKCN1LL2LR,https://s2.reutersmedia.net/resources/r/?m=02&d=20180905&t=2&i=1301053964&w=1200&r=LYNXNPEE841N4,0.5433446228407296,17,0.9946799691203388,0.35357293415242674,0.9542010550771131,4,1
13,Reuters Editorial,"WASHINGTON (Reuters) - Democrats on Sunday criticized the Trump administration for refusing to release thousands of documents on Brett Kavanaugh ahead of this week’s upcoming Senate hearings on his nomination to the U.S. Supreme Court. Kavanaugh, nominated by… [+2041 chars]",Democrats on Sunday criticized the Trump administration for refusing to release thousands of documents on Brett Kavanaugh ahead of this week's upcoming Senate hearings on his nomination to the U.S. Supreme Court.,text,2018-09-02T16:00:51Z,reuters,Reuters,Democrats slam White House for withholding documents on Supreme Court nominee,https://www.reuters.com/article/us-usa-court-kavanaugh/democrats-slam-white-house-for-withholding-documents-on-supreme-court-nominee-idUSKCN1LI0MH,https://s4.reutersmedia.net/resources/r/?m=02&d=20180902&t=2&i=1299969620&w=1200&r=LYNXNPEE810J9,0.6391253541452957,2,0.1410202385344771,0.4430457361326543,0.7764369466655601,2,3
14,Reuters Editorial,"WASHINGTON (Reuters) - Brett Kavanaugh, President Donald Trump’s Supreme Court nominee, raised questions as a White House aide more than a decade ago about whether the 1973 high court ruling legalizing abortion was settled law, the New York Times reported on … [+1816 chars]","Brett Kavanaugh, President Donald Trump's Supreme Court nominee, raised questions as a White House aide more than a decade ago about whether the 1973 high court ruling legalizing abortion was settled law, the New York Times reported on Thursday, citing leaked…",text,2018-09-06T14:46:48Z,reuters,Reuters,Emails indicate Trump nominee Kavanaugh questioned abortion ruling: NY Times,https://www.reuters.com/article/us-usa-court-kavanaugh-documents/emails-indicate-trump-nominee-kavanaugh-questioned-abortion-ruling-ny-times-idUSKCN1LM24T,https://s3.reutersmedia.net/resources/r/?m=02&d=20180906&t=2&i=1301494107&w=1200&r=LYNXNPEE851DN,0.7555944508556021,4,0.165710035399955,0.585138176226872,0.46888629805640414,6,1
15,https://www.facebook.com/bbcnews,"The Senate has scheduled a public hearing on a sex assault claim against Supreme Court nominee Brett Kavanaugh next Monday. Mr Kavanaugh and Christine Blasey Ford, the woman who says he attacked her 36 years ago, will both be able to testify, a senator said. … [+303 chars]",The Supreme Court nominee and his accuser are reportedly both invited to appear before senators.,text,2018-09-17T22:30:43Z,bbc-news,BBC News,Kavanaugh and accuser to testify in Senate,https://www.bbc.co.uk/news/world-us-canada-45555359,https://ichef.bbci.co.uk/news/1024/branded_news/7A23/production/_97176213_breaking_news_bigger.png,0.6993438372564779,14,0.12692826009622848,0.09769353453979235,0.9857511592391339,9,2
16,https://www.facebook.com/philip.bump,"In a dramatic interaction Thursday morning during Senate Judiciary Committee hearings on the nomination of Brett Kavanaugh to serve on the Supreme Court, Sen. Cory Booker announced that he would deliberately violate rules against releasing protected informati… [+9721 chars]","Washington Post Cory Booker's Senate rules drama, explained Washington Post In a dramatic interaction Thursday morning during Senate Judiciary Committee hearings on the nomination of Brett Kavanaugh to serve on the Supreme Court, Sen. Cory Booker announced th…",text,2018-09-06T18:08:54Z,the-washington-post,The Washington Post,"Cory Booker's Senate rules drama, explained - Washington Post",https://www.washingtonpost.com/politics/2018/09/06/cory-bookers-dramatic-violation-senate-rules-explained/,https://www.washingtonpost.com/resizer/J_l-tyr_rcdL8xAnf70Oh7s7y6g=/1484x0/arc-anglerfish-washpost-prod-washpost.s3.amazonaws.com/public/NFVA4WVR4YI6RC2TKAIWO2HETE.jpg,0.06346898344171237,11,0.6965521003205366,0.0561648244216314,0.93460882536092,8,2
17,,"The 2020 presidential campaign came roaring into Judge Brett M. Kavanaugh’s confirmation hearings this week, with a pair of prospective Democratic candidates going to extraordinary lengths to demonstrate their opposition to President Trump’s Supreme Court nom… [+8636 chars]","Washington Post Potential 2020 candidates use Kavanaugh hearings to show resistance to Trump Washington Post The 2020 presidential campaign came roaring into Judge Brett M. Kavanaugh's confirmation hearings this week, with a pair of prospective Democratic can…",text,2018-09-07T12:25:15Z,the-washington-post,The Washington Post,Potential 2020 candidates use Kavanaugh hearings to show resistance to Trump - Washington Post,https://www.washingtonpost.com/powerpost/potential-2020-candidates-use-kavanaugh-hearings-to-show-resistance-to-trump/2018/09/06/e99b8780-b11d-11e8-aed9-001309990777_story.html,https://www.washingtonpost.com/resizer/I1fG2yWUJ4cIsqoRjZa1YXn_nio=/1484x0/arc-anglerfish-washpost-prod-washpost.s3.amazonaws.com/public/5TEI6CFSFII6RIQLL5HYIQUWMY.jpg,0.49627786522376727,3,0.41524744566929317,0.32244996959102956,0.6217467284629931,7,1
18,Bryan Logan,"Democratic senators kept the heat on Judge Brett Kavanaugh on the third day of his Senate confirmation hearings, asking pointed questions about his leanings on women's rights, racial profiling, and the potential role he could play if a case related to the Rus… [+1965 chars]",Judge Brett Kavanaugh on the third day of his Senate confirmation hearings dodged questions about whether he would recuse himself from cases related to the special counsel Robert Mueller or the Russia investigation if they reach the Supreme Court. Sen. Cory B…,text,2018-09-07T04:19:34Z,business-insider,Business Insider,Brett Kavanaugh ducked questions about whether he would recuse himself from Supreme Court cases related to the Russia investigation,https://www.businessinsider.com/brett-kavanaugh-on-recusal-mueller-russia-probe-2018-9,https://amp.businessinsider.com/images/5b91fbe50ce5f591208b4e45-2732-1366.jpg,0.976587761334918,3,0.8584260410926484,0.7934967411810487,0.9542456964790051,6,3
19,Associated Press,"WASHINGTON (AP) — Senate Democrats worked into the night in a last, ferocious attempt to paint Supreme Court nominee Brett Kavanaugh as a foe of abortion rights and a likely defender of President Donald Trump. But after two marathon days in the witness chair … [+5787 chars]","Andrew Harnik/AP After two marathon days in the witness chair in a Senate hearing room, Kavanaugh appeared to be on a path to confirmation as a Supreme Court justice. Friday will be the last day of the hearings before the Senate Judiciary Committee. Senate De…",text,2018-09-07T09:45:05Z,business-insider,Business Insider,"Kavanaugh looks polished, set for confirmation despite protests, outcry",https://www.businessinsider.com/kavanaugh-looks-polished-set-for-confirmation-despite-protests-outcry-2018-9,https://amp.businessinsider.com/images/5b9248441982d88d308b4e5d-1334-667.jpg,0.5674345703304361,3,0.8708782810479746,0.21950015148851643,0.9046015585256448,6,3
20,https://www.facebook.com/amarimow,"The first day of the confirmation hearings for Supreme Court nominee Brett M. Kavanaugh introduced the country — briefly — to the nominee, who pledged in his opening statement to be “a neutral and impartial arbiter who favors no litigant or policy.” On Wednes… [+10966 chars]","Washington Post Ten issues likely to come up on second day of Kavanaugh hearings Washington Post The first day of the confirmation hearings for Supreme Court nominee Brett M. Kavanaugh introduced the country — briefly — to the nominee, who pledged in his open…",text,2018-09-05T10:00:41Z,the-washington-post,The Washington Post,Ten issues likely to come up on second day of Kavanaugh hearings - Washington Post,https://www.washingtonpost.com/local/public-safety/ten-issues-likely-to-come-up-on-second-day-of-kavanaugh-hearings/2018/09/05/2ca796b4-ac5e-11e8-a8d7-0f63ab8b1370_story.html,https://www.washingtonpost.com/resizer/N3f-uTOjeAN1ZO8idw42GE2sNVw=/1484x0/arc-anglerfish-washpost-prod-washpost.s3.amazonaws.com/public/WX27Y4FGHUI6RJSWSQ7O7K25V4.jpg,0.2698232176463985,7,0.6832875829057654,0.05194629557447594,0.627294967255958,8,2
21,Reuters Editorial,"(Reuters) - President Donald Trump’s nomination of Brett Kavanaugh to the U.S. Supreme Court is before a Senate committee that is struggling to advance it after a woman alleged Kavanaugh sexually assaulted her when they were in high school in 1982. Trump, dro… [+3882 chars]",President Donald Trump's nomination of Brett Kavanaugh to the U.S. Supreme Court is before a Senate committee that is struggling to advance it after a woman alleged Kavanaugh sexually assaulted her when they were in high school in 1982. US,text,2018-09-21T18:00:51Z,reuters,Reuters,Factbox: Kavanaugh's Supreme Court bid hinges on handful of senators,https://www.reuters.com/article/us-usa-court-senate-factbox/factbox-kavanaughs-supreme-court-bid-hinges-on-handful-of-senators-idUSKCN1M12G0,https://s2.reutersmedia.net/resources/r/?m=02&d=20180921&t=2&i=1306814252&w=1200&r=LYNXNPEE8K1KB,0.21863743843653294,15,0.20597911190152973,0.458398982585291,0.2716624869314377,7,1
22,Guardian staff,"Late-night hosts discussed the allegation of sexual assault being leveled against the supreme court nominee Brett Kavanaugh and how the Republican party has been handling it. Trevor Noah The Daily Show (@TheDailyShow) Um, why are all of these arguments about … [+4094 chars]",Late-night hosts discussed the sexual assault allegations against Brett Kavanaugh and how it could affect his hearing Late-night hosts discussed the allegation of sexual assault being leveled against the supreme court nominee Brett Kavanaugh and how the Repub…,text,2018-09-20T15:11:22Z,the-guardian-au,The Guardian (AU),Trevor Noah: 'Let's not add attempted rape to the list of stuff drunk boys do',https://www.theguardian.com/culture/2018/sep/20/late-night-roundup-trevor-noah-brett-kavanaugh-sexual-assault-accusation,https://i.guim.co.uk/img/media/0a7bfcb8d69052c7f7b530427f0c032a11881070/128_0_1497_898/master/1497.png?width=1200&height=630&quality=85&auto=format&usm=12&fit=crop&crop=faces%2Centropy&bm=normal&ba=bottom%2Cleft&blend64=aHR0cHM6Ly9hc3NldHMuZ3VpbS5jby51ay9pbWFnZXMvb3ZlcmxheXMvZDM1ODZhNWVmNTc4MTc1NmQyMWEzYjYzNWU1MTcxNDEvdGctZGVmYXVsdC5wbmc&s=c955e30d90b9e5658934530098e905c4,0.2926239536100512,8,0.7525356073005193,0.29182792991275275,0.5764730769383786,7,1
23,https://www.facebook.com/bbcnews,"Image copyright Reuters Image caption Brett Kavanaugh had been seen as a safe choice for Supreme Court nominee On paper, US President Donald Trump's nominee to the Supreme Court, Brett Kavanaugh, has an impeccable legal pedigree and is seen as a safe pair of … [+3824 chars]",The ex-White House lawyer was seen as a safe pick until sexual misconduct allegations surfaced.,text,2018-09-24T10:17:59Z,bbc-news,BBC News,The man Trump wants on the US Supreme Court,https://www.bbc.co.uk/news/world-us-canada-45625375,https://ichef.bbci.co.uk/news/1024/branded_news/10383/production/_103553466_049357414-1.jpg,0.08953470006520658,1,0.34850117185375085,0.10822763941025793,0.10493346942465198,2,2
24,,Sen. Patrick J. Leahy (D-Vt.) said Friday that Supreme Court nominee Brett Kavanaugh was “not truthful” when he denied knowing that he had received documents that Leahy said had been “stolen” from him and other Democrats. Leahy said that emails disclosed duri… [+4752 chars],Washington Post Leahy says Kavanaugh was 'not truthful' about Democratic documents Washington Post Sen. Patrick J. Leahy (D-Vt.) said Friday that Supreme Court nominee Brett Kavanaugh was “not truthful” when he denied knowing that he had received documents th…,text,2018-09-07T22:16:08Z,the-washington-post,The Washington Post,Leahy says Kavanaugh was 'not truthful' about Democratic documents - Washington Post,https://www.washingtonpost.com/politics/leahy-says-kavanaugh-was-not-truthful-about-democratic-documents/2018/09/07/babfb4aa-b2d9-11e8-a20b-5f4f84429666_story.html,https://www.washingtonpost.com/resizer/dxNIjTbjZQcfGyhz1fXQxlWk1QI=/1484x0/arc-anglerfish-washpost-prod-washpost.s3.amazonaws.com/public/MAVLFSFRNAI6RC2TKAIWO2HETE.jpg,0.45649978163785654,13,0.7904510595990237,0.06831605373615379,0.07075038519188204,1,1
25,Richard Cowan,WASHINGTON (Reuters) - A Democratic senator on Tuesday raised new questions about whether U.S. Supreme Court nominee Brett Kavanaugh has accurately described his role in a controversial judicial nomination when he worked for then President George W. Bush. Ema… [+2467 chars],A Democratic senator on Tuesday raised new questions about whether U.S. Supreme Court nominee Brett Kavanaugh has accurately described his role in a controversial judicial nomination when he worked for then President George W. Bush.,text,2018-09-11T21:35:25Z,reuters,Reuters,Supreme Court nominee emails reignite Democratic query on past testimony,https://www.reuters.com/article/us-usa-court-kavanaugh/supreme-court-nominee-emails-reignite-democratic-query-on-past-testimony-idUSKCN1LR2KV,https://s4.reutersmedia.net/resources/r/?m=02&d=20180911&t=2&i=1303331713&w=1200&r=LYNXNPEE8A1KV,0.0045408047033012044,19,0.19643570009662836,0.1578809774390354,0.2380784132098499,5,2
